Plant Id,Plant Name,Entity Id,Entity Name,County,State,Latitude,Longitude
60456,Oneida - West,60239,"Oneida DG Solar, LLC",Oneida,NY,43.169617,-75.40487
60457,Athens Energy,60242,"Athens Energy, LLC",Somerset,ME,44.945514,-69.66071
60458,Hardwick-Athol & Eagle Hill,60240,"SEC CRSD Solar One, LLC",Worcester,MA,42.308391,-72.18958
60459,Port Comfort Power LLC,61199,"Peaker Power, LLC",Calhoun,TX,28.64807,-96.54621
6046,DeBary,6455,"Duke Energy Florida, LLC",,,28.903863,-81.33233
6046,DeBary,6455,"Duke Energy Florida, LLC",Volusia,FL,28.903863,-81.33233
60460,Chamon Power LLC,61199,"Peaker Power, LLC",Harris,TX,29.883214,-95.11135
60461,The Clorox Company,60947,Tesla Inc.,Harford,MD,39.472128,-76.20134
60462,Onondaga County- Clearwater,60947,Tesla Inc.,Oswego,NY,43.429317,-76.51572
60463,Greene County Meter #1,60947,Tesla Inc.,Greene,NY,42.294823,-74.00076
60464,Tenaska Westmoreland Generating Station,60249,"Tenaska Pennsylvania Partners, LLC",Westmoreland,PA,40.175249,-79.69667
60465,Chesapeake College,60947,Tesla Inc.,Queen Annes,MD,38.953389,-76.08324
60466,Waterman Turnout Hydroelectric,60217,San Bernardino Valley Mun. Water Dist.,San Bernardino,CA,34.172625,-117.278
60467,Red Rock,803,Arizona Public Service Co,Maricopa,AZ,32.551026,-111.2892
60468,Friendswood Energy,60252,"Friendswood Energy Genco, LLC",Harris,TX,29.647267,-95.45152
60469,Solar Glynn,61060,Cypress Creek Renewables,Glynn,GA,31.25,-81.433
6047,Deerfield 2,61122,"Great River Hydro, LLC",Franklin,MA,42.573084,-72.70727
60470,Paulding Wind Farm III,60258,Paulding Wind Farm III LLC,Paulding,OH,41.121,-84.751
60471,Green River Wind Farm,60259,"Green River Wind Farm, LLC",Lee,IL,41.620264,-89.55703
60472,CPS 1 Community Solar,58519,Clean Energy Collective LLC,Bexar,TX,29.377966,-98.26922
60473,Westport MA 1 Community Solar,58519,Clean Energy Collective LLC,Bristol,MA,41.621068,-71.05696
60474,"Bayshore Solar B, LLC",58661,"Sustainable Power Group, LLC",Los Angeles,CA,34.678305,-118.3026
60475,"Bayshore Solar C, LLC",58661,"Sustainable Power Group, LLC",Los Angeles,CA,34.681338,-118.3141
60476,Westport MA 2 Community Solar,58519,Clean Energy Collective LLC,Bristol,MA,41.621068,-71.05696
60477,Bethlehem - East,60250,"DG Bethlehem Solar, LLC",Albany,NY,42.539006,-73.8243
60478,Bethlehem - West,60250,"DG Bethlehem Solar, LLC",Albany,NY,42.539006,-73.8243
60479,LIRR Malverne Wayside Energy Storage Sys,60262,Electrical Power worX Corp,,,40.675278,-73.67306
60480,"Germantown Solar, LLC",61060,Cypress Creek Renewables,Forsyth,NC,36.24634,-80.25463
60481,"Bayshore Solar A, LLC",58661,"Sustainable Power Group, LLC",Los Angeles,CA,34.667817,-118.2981
60483,Clark Canyon Hydro-Electric Facility,60270,"Clark Canyon Hydro, LLC",Beaverhead,MT,44.999,-112.857
60484,"Williamston West Farm, LLC",60234,"Williamston West Farm, LLC",Martin,NC,35.836544,-77.10804
60485,"Longboat Solar, LLC",60271,"Longboat Solar, LLC",San Bernardino,CA,34.541,-117.061
60486,Greenfield Wind - MT,60025,Greenbacker Renewable Energy Corporation,Teton,MT,47.723,-111.963
60487,"River Road Solar, LLC",60280,"River Road Solar, LLC",Hertford,NC,36.351,-76.842
60489,Hamilton Solar-Crosswicks,60267,Hartz Solar Hamilton LLC,Mercer,NJ,40.168958,-74.6301
6049,West Tisbury Generating Facility,21461,NRG Canal LLC,Dukes,MA,41.392486,-70.62009
60490,Redwood 4 Solar Farm,60277,54 KR 8me LLC,Kern,CA,35.314198,-118.8119
60491,Springbok 3 Solar Farm,60278,64KT 8me LLC,Kern,CA,35.171153,-118.0017
60492,Rail Trail,60281,"Altus Power America Management, LLC",Berkshire,MA,42.243134,-73.36385
60493,Rising Paper,60281,"Altus Power America Management, LLC",Berkshire,MA,42.228622,-73.34446
60494,Hampden,60281,"Altus Power America Management, LLC",Hampden,MA,42.044663,-72.43875
60495,Little Bay,60281,"Altus Power America Management, LLC",Providence,RI,41.799201,-71.43605
60496,MEBA,60281,"Altus Power America Management, LLC",Talbot,MD,38.772903,-76.13891
60497,SR Skylark B,60263,"SR Skylark B, LLC",Weld,CO,40.579472,-104.8957
60498,Shirley Water,60281,"Altus Power America Management, LLC",Middlesex,MA,42.554584,-71.62348
60499,Jefferson Avenue,60268,Hartz Solar LLC,Hudson,NJ,40.772215,-74.06867
60500,Westside Avenue,60268,Hartz Solar LLC,Hudson,NJ,40.814092,-74.02133
60501,Hartz Way,60268,Hartz Solar LLC,Hudson,NJ,40.782829,-74.07278
60502,"Tyler Bluff Wind Project, LLC",17650,Southern Power Co,Cooke,TX,33.703851,-97.37201
60503,Cattle Ridge Wind Farm 1,61416,"Crowned Ridge Wind, LLC",Grant,SD,45.154947,-96.83684
60504,Blazing Star Wind Farm 1,60289,"Blazing Star Wind Farm, LLC",Lincoln,MN,44.544137,-96.36824
60505,Crocker Wind Farm,60290,"Crocker Wind Farm, LLC",Clark,SD,45.051544,-97.82642
60506,ETT Presidio NaS Battery,50174,Electric Transmission Texas LLC,Presidio,TX,29.566263,-104.3554
60507,Broome County,60947,Tesla Inc.,Broome,NY,42.104731,-75.93073
60509,Valley Center,59462,"Heelstone Energy Holdings, LLC",San Diego,CA,33.2503,-117.0226
6051,Edwin I Hatch,7140,Georgia Power Co,Appling,GA,31.9342,-82.3447
60510,Two Mile Desert Project,58871,Citizens Enterprises Corporation,Perquimans,NC,36.22,-76.46
60511,Clear Spring Ranch PV Project,60293,"DG Colorado Solar, LLC",El Paso,CO,38.602102,-104.6947
60514,Seminole,57081,"WGL Energy Systems, Inc",Seminole,GA,31.065112,-84.9317
60516,Granger,59462,"Heelstone Energy Holdings, LLC",San Diego,CA,33.2704,-117.0588
60517,Hancock Creek Hydroelectric Project,17470,PUD 1 of Snohomish County,King,WA,47.5722,-121.6897
60518,Stafford Hill Solar,7601,Green Mountain Power Corp,Rutland,VT,43.619444,-72.95028
60519,Albany Solar,59380,"Enel Green Power NA, Inc.",Stearns,MN,45.641268,-94.59925
6052,Wansley,7140,Georgia Power Co,Heard,GA,33.41342,-85.03233
60520,Annandale Solar,59380,"Enel Green Power NA, Inc.",Wright,MN,45.247009,-94.10693
60521,Atwater Solar,59380,"Enel Green Power NA, Inc.",Kandiyohi,MN,45.140869,-94.76973
60522,Chisago Solar,59380,"Enel Green Power NA, Inc.",Chisago,MN,45.452479,-92.90195
60523,Dodge Center Solar,59380,"Enel Green Power NA, Inc.",Dodge,MN,44.026007,-92.88155
60524,Eastwood Solar,59380,"Enel Green Power NA, Inc.",Blue Earth,MN,44.154526,-93.91656
60525,Hastings Solar,59380,"Enel Green Power NA, Inc.",Dakota,MN,44.759275,-92.82488
60526,Lake Emily Solar,59380,"Enel Green Power NA, Inc.",Nicollet,MN,44.320364,-93.90317
60527,Lake Pulaski Solar,59380,"Enel Green Power NA, Inc.",Wright,MN,45.195854,-93.81214
60528,Lawrence Creek Solar,59380,"Enel Green Power NA, Inc.",Chisago,MN,45.401289,-92.69373
60529,Montrose Solar,59380,"Enel Green Power NA, Inc.",Wright,MN,45.055628,-93.92281
60530,Paynesville Solar,59380,"Enel Green Power NA, Inc.",Stearns,MN,45.392905,-94.72123
60531,Pine Island Solar,59380,"Enel Green Power NA, Inc.",Goodhue,MN,44.206624,-92.66365
60532,Waseca Solar,59380,"Enel Green Power NA, Inc.",Waseca,MN,44.092414,-93.53098
60533,West Faribault Solar,59380,"Enel Green Power NA, Inc.",Rice,MN,44.274932,-93.31063
60534,West Waconia Solar,59380,"Enel Green Power NA, Inc.",Carver,MN,44.789894,-93.90129
60535,"Saluda Solar, LLC",61060,Cypress Creek Renewables,Saluda,SC,33.96839,-81.7829
60536,UA Central Utility Plant,60295,University Of Arkansas,Washington,AR,36.066336,-94.17225
60537,Limerick Road Solar Farm,60297,"Limerick Road Solar, LLC",Chittenden,VT,44.368889,-73.24708
60538,"Langdon Solar Farm, LLC",60298,"Langdon Solar Farm, LLC",Johnston,NC,35.447278,-78.41348
60539,Innovative Solar 42,60303,"Innovative Solar 42, LLC",Bladen,NC,34.847627,-78.87736
60540,Innovative Solar 31,60304,"Innovative Solar 31, LLC",Bladen,NC,34.539425,-78.75539
60541,Wind GEM,60302,"Wind GEM, LLC",Adair,IA,41.469985,-94.33936
60542,158th Fighter Wing Solar Farm,60301,158th Fighter Wing,Chittenden,VT,44.477705,-73.15341
60544,Tri-County Solar Facility,7140,Georgia Power Co,Putnam,GA,33.308113,-83.3896
60545,"Grant Plains Wind, LLC",17650,Southern Power Co,Grant,OK,36.9708,-97.7053
60546,KIUC Kapaia PV and BA Storage Project,60947,Tesla Inc.,Kauai,HI,21.997272,-159.3792
60547,GMP Solar - Richmond,7601,Green Mountain Power Corp,Chittenden,VT,44.42691,-73.00849
60548,"NorWest Energy 2, LLC",61060,Cypress Creek Renewables,Deschutes,OR,44.06803,-121.2284
60549,"ZV Solar 3, LLC",61119,"SRE Utility Solar 1, LLC",Robeson,NC,34.816182,-79.20022
6055,Big Cajun 2,11252,Louisiana Generating LLC,Pointe Coupee,LA,30.7261,-91.3692
60550,GRP Franklin Renewable Energy Facility,60251,"GRP Franklin Renewable Energy Facility, LLC",Franklin,GA,34.376111,-83.33056
60551,Big Level Wind,60328,Big Level Wind LLC,Potter,PA,41.869326,-77.66594
60552,Hattiesburg Solar Farm,60326,"Hattiesburg Farm, LLC",Forrest,MS,31.275828,-89.30116
60553,Southerland Farm Solar,60327,"Southerland Farm Solar, LLC",Vance,NC,36.265611,-78.36781
60554,Hazlehurst II,60330,"SR South Loving, LLC",Jeff Davis,GA,31.819444,-82.60222
60555,Selmer I,60331,"Selmer North Solar I, LLC",McNairy,TN,35.140556,-88.55111
60556,Selmer II,60332,"Selmer North Solar II, LLC",McNairy,TN,35.166111,-88.64667
60558,Solar Blythe 2,60307,NRG Solar Blythe II LLC,Riverside,CA,33.618678,-114.6962
60559,Marquette Energy Center,11701,City of Marquette - (MI),Marquette,MI,46.56597,-87.43725
6056,Kahului,11843,Maui Electric Co Ltd,Maui,HI,20.896884,-156.4627
60560,Millington Solar Farm,60334,"SR Millington, LLC",Shelby,TN,35.351533,-89.85473
60561,Cedartown Battery Energy Storage Project,7140,Georgia Power Co,Polk,GA,34.041026,-85.22325
60562,GMP Solar - Panton,7601,Green Mountain Power Corp,Addison,VT,44.085795,-73.19539
60563,Flywheel Energy Storage System Microgrid,10433,Kodiak Electric Assn Inc,Kodiak Island,AK,57.780114,-152.4438
60564,Westside Energy Station,16181,Rochester Public Utilities,Olmsted,MN,44.039023,-92.55187
60565,Borrego Springs Energy Storage,60336,SDGE Batteries,San Diego,CA,33.27011,-116.3496
60566,Pala Energy Storage Yard,60336,SDGE Batteries,San Diego,CA,33.35651,-117.1136
60567,Ortega Highway Energy Storage,60336,SDGE Batteries,Orange,CA,33.562061,-117.5438
60568,Canyon Crest Academy,60336,SDGE Batteries,San Diego,CA,32.95907,-117.1916
60569,El Cajon Energy Storage,16609,San Diego Gas & Electric Co,San Diego,CA,32.8115,-117.0505
60570,Escondido Energy Storage,16609,San Diego Gas & Electric Co,San Diego,CA,33.124446,-117.1143
60571,North City Cogeneration Facility,16764,City of San Diego,San Diego,CA,32.877822,-117.1978
60572,White Wing Solar,56615,First Solar Project Development,Yuma,AZ,32.994056,-113.5088
60573,HQC Rock River Solar Power Gen Station,60338,HQC Rock River Solar Power Generation Station LLC,Rock,WI,42.578831,-89.03302
60574,"Great Western Wind Energy, LLC",57170,"EDF Renewable Asset Holdings, Inc.",Ellis,OK,36.166503,-99.59601
60575,Wadesboro Farm 2,60341,"Wadesboro Farm 2, LLC",Anson,NC,35.023406,-80.09319
60576,Wadesboro Farm 3,60342,"Wadesboro Farm 3, LLC",Anson,NC,34.969356,-80.05103
60577,Hector Farm,60343,"Hector Farm, LLC",Montgomery,NC,35.376236,-79.90972
60578,Kojak Farm,60344,"Kojak Farm, LLC",Nash,NC,35.79915,-78.10218
60579,Meriwether Farm,60345,"Meriwether Farm, LLC",Granville,NC,36.288911,-78.60459
6058,Cascade Creek,16181,Rochester Public Utilities,Olmsted,MN,44.0322,-92.4908
60580,Soluga Farms III,60346,"Soluga Farms III, LLC",Cumberland,NC,35.219272,-78.67333
60581,Upton County Solar,56769,Consolidated Edison Development Inc.,Upton,TX,31.241808,-102.2903
60582,CoTAL Solar Farm,60348,"FL Solar 1, LLC",Leon,FL,30.37926,-84.35394
60583,LaFayette Solar Farm,60347,"AL Solar A, LLC",Chambers,AL,32.876313,-85.38821
60584,Oceana Solar,19876,Virginia Electric & Power Co,Virginia Beach City,VA,36.789753,-76.05142
60585,Mount Vernon Solar,20065,Walton Electric Member Corp,Walton,GA,33.8388,-83.638
60586,Pleasant Valley Solar,20065,Walton Electric Member Corp,Walton,GA,33.7368,-83.6971
60587,Kelly Creek Wind Project,57170,"EDF Renewable Asset Holdings, Inc.",Ford,IL,40.9675,-88.1975
60588,Sweetheart Lake Hydroelectric Facility,60349,"Juneau Hydropower, Inc",Juneau,AK,57.9449,-133.6867
60589,CPV Fairview Energy Center,60350,"CPV Fairview, LLC",Cambria,PA,40.412,-78.855
60590,"Golden Fields Solar I, LLC",60352,"Golden Fields Solar I, LLC",Kern,CA,34.839012,-118.3868
60591,"Solar Star California, XLI, LLC",60353,"Solar Star California, XLI, LLC",Kern,CA,34.839012,-118.3868
60592,Rush Springs Wind,60819,Rush Springs Wind Project,Stephens,OK,34.682883,-97.82928
60593,UI RCP Woodbridge FC,19497,United Illuminating Co,New Haven,CT,41.358035,-73.00781
60594,Voyager Wind I,2770,Terra-Gen Operating Co LLC,Kern,CA,35.046061,-118.2827
60596,Baron Winds Farm,58672,Everpower Wind Holdings Inc,Steuben,NY,42.375,-77.593
60597,Wayne Solar III LLC,60163,Soltage LLC,Wayne,NC,35.324377,-77.87123
60598,Wayne Solar II LLC,60163,Soltage LLC,Wayne,NC,35.31556,-78.07948
60599,Duplin Solar I LLC (160 Houston Lane),60163,Soltage LLC,Duplin,NC,34.960083,-77.98039
6060,Coachella,9216,Imperial Irrigation District,Riverside,CA,33.6758,-116.1714
60600,Old Pageland Monroe Road Solar Farm,61060,Cypress Creek Renewables,Union,NC,34.95233,-80.48191
60601,Bay Branch Solar,61677,Sol Systems,Beaufort,NC,35.4745,-77.1191
60602,Wayne Solar I LLC,60163,Soltage LLC,Wayne,NC,35.221083,-78.01903
60603,Jacobson 5 MW Solar,19728,"UNS Electric, Inc",Mohave,AZ,35.304528,-114.0118
60604,Wye Mills VNEM CSG,60947,Tesla Inc.,Queen Annes,MD,38.94037,-76.04566
60605,CMEEC - Rogers Rd Solar,60947,Tesla Inc.,New London,CT,41.538324,-72.12254
60607,CMEEC - Polaris Park Solar,60947,Tesla Inc.,New London,CT,41.381256,-72.07689
60608,CMEEC - Navy NE Trident,60947,Tesla Inc.,New London,CT,41.39546,-72.07919
60609,CMEEC - Norwich Stott St Solar,60947,Tesla Inc.,New London,CT,41.576946,-72.10461
6061,R D Morrow,17568,Cooperative Energy,Lamar,MS,31.2186,-89.394
60610,St. Mary Clean Energy Center,3265,Cleco Power LLC,St Mary,LA,29.68455,-91.47062
60611,Summit Farms Solar,60359,Summit Farms LLC,Currituck,NC,36.4765,-76.136
60612,Morin Solar 2013 LLC,60163,Soltage LLC,Worcester,MA,42.166995,-72.1929
60613,Brookfield Solar 2013 LLC,60163,Soltage LLC,Worcester,MA,42.25609,-72.06788
60614,WYM 1250 Palmer LLC,60163,Soltage LLC,Hampden,MA,42.151092,-72.26974
60615,Southern Sky Renew Energy Berkley LLC,60163,Soltage LLC,Bristol,MA,41.83777,-71.0913
60616,BC Solar,60358,BC Solar,Lake,OR,42.175,-120.3598
60617,AEP Churubusco NaS,9324,Indiana Michigan Power Co,Whitley,IN,41.2326,-85.3149
60618,AEP Bluffton NaS,14006,Ohio Power Co,Allen,OH,40.8928,-83.8863
60619,Rush Creek Wind,15466,Public Service Co of Colorado,Elbert,CO,39.172111,-103.8454
60620,"Ninnescah Wind Energy, LLC",60364,Ninnescah Wind Energy LLC,Pratt,KS,37.586714,-98.57926
60621,Worcester Landfill,60369,City of Worcester DPW,Worcester,MA,42.219,-71.791
60622,DG AMP Solar Bowling Green,60370,"DG AMP Solar, LLC",Wood,OH,41.396,-83.582
60623,Brantley Solar,61694,John Laing US Solar Corp.,Nash,NC,35.890485,-78.15515
60624,Fox Creek Solar,61694,John Laing US Solar Corp.,Franklin,NC,36.126912,-78.27311
60625,NRG Renew Canal 1 CSG LLC,60365,NRG Renew Canal 1 LLC,Barnstable,MA,41.766987,-70.52117
60626,BRE NC Solar 2,60366,"BRE NC Solar 2, LLC",Warren,NC,36.342161,-78.17322
60627,BRE NC Solar 3,60367,"BRE NC Solar 3, LLC",Granville,NC,36.383,-78.612
60628,BRE NC Solar 4,60368,"BRE NC Solar 4, LLC",Warren,NC,36.351759,-78.14985
60629,"Perkins Solar, LLC",61060,Cypress Creek Renewables,Person,NC,36.43741,-78.97198
6063,Electrifarm,12341,MidAmerican Energy Co,Black Hawk,IA,42.4407,-92.4205
60630,Howardtown Farm,60379,"Howardtown Farm, LLC",Robeson,NC,34.813083,-78.95005
60631,Empire Solar,61060,Cypress Creek Renewables,Dakota,MN,44.66438,-93.10881
60632,Blue Lake Solar,61060,Cypress Creek Renewables,Scott,MN,44.79642,-93.42959
60633,"Gainey Solar, LLC",61060,Cypress Creek Renewables,Bladen,NC,34.499,-78.653
60634,"Auten Road Farm, LLC",61060,Cypress Creek Renewables,Gaston,NC,35.30498,-81.13735
60635,"Creech Solar 2, LLC",61060,Cypress Creek Renewables,Wake,NC,35.72196,-78.60434
60636,"Bunn Level Farm, LLC",60378,"Bunn Level Farm, LLC",Harnett,NC,35.308639,-78.77433
60637,Cork Oak Solar,60380,Cork Oak Solar LLC,Halifax,NC,36.371,-77.571
60638,Sunflower Solar,60381,Sunflower Solar LLC,Halifax,NC,36.395,-77.593
60639,Kingman Wind,60371,"Kingman Wind Energy, LLC",Pratt,KS,37.586714,-98.57926
6064,Nearman Creek,9996,City of Kansas City - (KS),Wyandotte,KS,39.1681,-94.6975
60640,"NRG Solar Mule, LLC",60363,"NRG Solar Mule, LLC",Kennebec,ME,44.557725,-69.67136
60641,Henrietta D Energy Storage LLC,60383,Henrietta D Energy Storage LLC,Kings,CA,36.228872,-119.9047
60642,M&G Resins USA,60340,"M&G Resins USA, LLC",Nueces,TX,27.833756,-97.49652
60644,"West Brookfield Solar, LLC",60163,Soltage LLC,Worcester,MA,42.222798,-72.12953
60645,"Javelina Wind Energy II, LLC",60384,"Javelina Wind Energy II, LLC",Webb,TX,27.44,-98.91
60647,Shakopee Energy Park,12667,Minnesota Municipal Power Agny,Scott,MN,44.783611,-93.48111
60649,Rabbit Hill Energy Storage Project,60389,Rabbit Hill Energy Storage Project,Williamson,TX,30.587828,-97.68702
6065,Iatan,10000,Kansas City Power & Light Co,Platte,MO,39.4472,-94.98
60650,Mission Rock Energy Center,60388,"Mission Rock Energy Center, LLC",Ventura,CA,34.30873,-119.1067
60651,"North Nash Farm, LLC",60390,"North Nash Farm, LLC",Nash,NC,36.070336,-78.03832
60652,Dickinson Solar Array,7570,Great River Energy,Wright,MN,45.11444,-93.8138
60653,Belchertown,60281,"Altus Power America Management, LLC",Hampshire,MA,42.259548,-72.40043
60654,Townsite Solar Project,60387,"Skylar Resources, LP",Clark,NV,35.937336,-114.884
60655,Rock Creek Wind Project,59380,"Enel Green Power NA, Inc.",Atchison,MO,40.4,-95.2
60656,McHenry Battery Storage,57170,"EDF Renewable Asset Holdings, Inc.",McHenry,IL,42.331411,-88.27435
60657,"Salt Fork Wind Project, LLC",17650,Southern Power Co,Donley,TX,35.18172,-100.9344
60658,Moffett Solar Project,60392,"Moffett Solar 1, LLC",Jasper,SC,32.635158,-81.00306
60659,Ridgeland Solar Project,60393,"Ridgeland Solar Farm I, LLC",Jasper,SC,32.465,-80.961
60660,Willey Battery Utility,60394,"Willey Battery Utility, LLC",Hamilton,OH,39.287747,-84.68031
60661,Mira Loma Energy Storage Facility,17609,Southern California Edison Co,San Bernardino,CA,34.006125,-117.5609
60662,Archdiocese of Baltimore J,60396,Constellation New Energy Inc.,Harford,MD,39.445,-76.217
60663,Archdiocese of Baltimore L,60396,Constellation New Energy Inc.,Harford,MD,39.445,-76.217
60664,Baltimore City B,60396,Constellation New Energy Inc.,Harford,MD,39.436,-76.22
60665,Baltimore City D,60396,Constellation New Energy Inc.,Harford,MD,39.436,-76.22
60666,Baltimore City F,60396,Constellation New Energy Inc.,Harford,MD,39.436,-76.22
60667,Baltimore City G,60396,Constellation New Energy Inc.,Harford,MD,39.436,-76.22
60668,City of Havre De Grace C,60396,Constellation New Energy Inc.,Harford,MD,39.436,-76.22
60669,Sod Run WTP A,60396,Constellation New Energy Inc.,Harford,MD,39.436,-76.22
60670,CE&P Imperial Valley 1,60395,"California Ethanol Power, LLC",Imperial,CA,32.912778,-115.5183
60672,Osborn Wind Energy,60397,Osborn Wind Energy LLC,DeKalb,MO,39.747699,-94.47348
60673,"Nixa Solar, LLC",60398,"Nixa Solar, LLC",Christian,MO,37.043903,-93.33897
60674,Tisch Mills Wind,59365,Capital Power Corporation,Manitowoc,WI,44.240851,-87.57328
60675,Turner Energy Storage Project,20169,Avista Corp,Whitman,WA,46.751832,-117.1614
60677,Tannery Road Landfill,60401,"Tannery Road Solar, LLC",Oneida,NY,43.239004,-75.53459
60678,San Joaquin Solar,60399,"GASNA 6P, LLC",Fresno,CA,36.527,-120.149
60679,Fort Rucker Solar Array,195,Alabama Power Co,Dale,AL,31.331148,-85.73019
6068,Jeffrey Energy Center,22500,Westar Energy Inc,Pottawatomie,KS,39.286453,-96.11723
60680,ANAD Solar Array,195,Alabama Power Co,Calhoun,AL,33.626728,-85.96948
60681,"Annapolis Solar Park, LLC",59474,BQ Energy LLC,Anne Arundel,MD,38.992144,-76.57377
60682,Pearl Solar,59359,"BHE Renewables, LLC",Pecos,TX,30.98784,-102.2683
60683,TRS Fuel Cell,60403,"TRS Fuel Cell, LLC",Fairfield,CT,41.3907,-73.4354
60684,Amphitheater High School Solar,60404,"Constellation Solar Arizona 2, LLC",Pima,AZ,32.269,-110.975
60685,Canyon Del Oro High School Solar,60404,"Constellation Solar Arizona 2, LLC",Pima,AZ,32.374,-110.974
60686,Pierre Solar,60408,Pierre Solar,Hughes,SD,44.388753,-100.307
60687,"Cimarron Bend Wind Project I, LLC",60406,"Cimarron Bend Wind Project I, LLC",Clark,KS,37.355,-99.991
60688,"Cimarron Bend Wind Project II, LLC",60407,"Cimarron Bend Wind Project II, LLC",Clark,KS,37.355,-99.991
60689,Western Plains Wind Farm,22500,Westar Energy Inc,Ford,KS,37.854801,-99.67981
60690,"Blue Summit Storage, LLC",60409,"Blue Summit Storage, LLC",Wilbarger,TX,34.299,-99.399
60691,Tanager Holdings,60410,"Tanager Holdings, LLC",Randolph,NC,35.7527,-79.78463
60692,Friesian Holdings,60411,"Friesian Holdings, LLC",Scotland,NC,34.713847,-79.54285
60693,FDS Co-Generation Facility,60405,"FDS Coke Plant, LLC",Lucas,OH,41.68242,-83.4675
60694,"WakeSun CSG, LLC",60970,SunShare Management,Stearns,MN,45.472889,-94.40642
60695,"BentonSun CSG, LLC",60970,SunShare Management,Carver,MN,44.766167,-93.85794
60696,Four Peaks Camino Real,59370,"ENERGYneering Solutions, Inc",Dona Ana,NM,31.811078,-106.5933
60698,Stanton Energy Reliability Center,20323,"Wellhead Energy, LLC",Orange,CA,33.806801,-117.9858
60699,DESI-1 Battery Energy Storage Facility,17609,Southern California Edison Co,Orange,CA,33.799248,-117.8734
607,Fredonia,15500,Puget Sound Energy Inc,Skagit,WA,48.4558,-122.4358
60700,Wind Colebrook South,60430,Wind Colebrook South,Litchfield,CT,41.961067,-73.14078
60701,JED Solid Waste Mgmt Renewable Energy,61351,APTIM Environmental & Infrastructure,Osceola,FL,28.063777,-81.09724
60702,Rincon Solar I,60424,"Rincon Solar I, LLC",Effingham,GA,32.292879,-81.2844
60703,"Green City Recovery, LLC",60428,"Green City Recovery, LLC",Scott,KY,38.345278,-84.54889
60704,Trenton Solar Farm (MO),58822,MC Power Companies Inc,Grundy,MO,40.1155,-93.6122
60705,Rolla Solar Farm (MO),58822,MC Power Companies Inc,Phelps,MO,37.9853,-91.7169
60706,Waynesville Solar Farm (MO),58822,MC Power Companies Inc,Pulaski,MO,37.8041,-92.2535
60707,Marshall Solar Farm (MO),58822,MC Power Companies Inc,Saline,MO,39.0948,-93.2104
60708,Havre de Grace II - E at Perryman,60396,Constellation New Energy Inc.,Harford,MD,39.436,-76.22
60709,IFF Hazlet Ground,56997,Marina Energy LLC,Monmouth,NJ,40.43819,-74.16015
6071,Trimble County,11249,Louisville Gas & Electric Co,Trimble,KY,38.5847,-85.4117
60710,Stone Hill Solar CSG,56997,Marina Energy LLC,Bristol,MA,42.059104,-71.08916
60711,Chisago Community Solar,60434,Chisago Community Solar,Chisago,MN,45.413357,-92.68296
60712,Ursa Community Solar,60435,Ursa Community Solar,Dakota,MN,44.671581,-93.08256
60713,Sunrise Community Solar,60436,Sunrise Community Solar,Chisago,MN,45.474994,-92.89109
60714,Rosemount Community Solar,60437,Rosemount Community Solar,Dakota,MN,44.72241,-93.02291
60715,Paynesville Community Solar,60438,Paynesville Community Solar,Stearns,MN,45.402543,-94.71547
60716,Orion Community Solar,60439,Orion Community Solar,Stearns,MN,45.587899,-94.40144
60717,Northfield Community Solar,60440,Northfield Community Solar,Dakota,MN,44.475433,-93.19831
60719,"Sadiebrook Solar, LLC",61298,Pine Gate Renewables,Charleston,SC,32.800091,-80.01224
6072,Grand Gulf,12465,"System Energy Resources, Inc",Claiborne,MS,32.0081,-91.0478
60720,Weld 1 Community Solar Array,60609,"Clean Focus Renewables, Inc.",Weld,CO,40.232146,-104.7919
60721,Green Cow Power,60441,Green Cow Power LLC,Elkhart,IN,41.536735,-85.9272
60722,Logan 1 Community Solar Array,60609,"Clean Focus Renewables, Inc.",Logan,CO,40.609968,-103.1451
60723,Conejos 1 Community Solar Array,60609,"Clean Focus Renewables, Inc.",Conejos,CO,37.195886,-105.9824
60724,Arapahoe 3 Community Solar Array,60609,"Clean Focus Renewables, Inc.",Arapahoe,CO,39.638358,-104.6742
60725,Xcel Adams 2 Community Solar Array,60609,"Clean Focus Renewables, Inc.",Adams,CO,39.784937,-104.5834
60726,Xcel Adams 1 Community Solar Array,60609,"Clean Focus Renewables, Inc.",Adams,CO,39.765479,-104.5886
60727,East Orange Solar,56997,Marina Energy LLC,Essex,NJ,40.747582,-74.33576
60728,Howell Solar,56997,Marina Energy LLC,Monmouth,NJ,40.147009,-74.16752
60729,Raritan Solar,56997,Marina Energy LLC,Hunterdon,NJ,40.464221,-74.85788
6073,Victor J Daniel Jr,12686,Mississippi Power Co,Jackson,MS,30.5322,-88.5553
60730,Bridgewater Solar CSG,56997,Marina Energy LLC,Plymouth,MA,41.964116,-70.97193
60731,Holliston Solar CSG,56997,Marina Energy LLC,Middlesex,MA,42.169641,-71.46822
60732,Frankford Solar,56997,Marina Energy LLC,Sussex,NJ,41.166566,-74.70165
60733,Brickyard Solar,56997,Marina Energy LLC,Monmouth,NJ,40.189425,-74.15448
60734,Bordentown Solar,56997,Marina Energy LLC,Burlington,NJ,40.0389,-74.7766
60735,Longview Solar,56997,Marina Energy LLC,Wicomico,MD,38.394728,-75.67272
60736,Wilmington Solar,56997,Marina Energy LLC,Middlesex,MA,42.546281,-71.17528
60737,Church Hill,56997,Marina Energy LLC,Queen Annes,MD,39.100947,-75.95968
60738,Fall River Solar CSG,56997,Marina Energy LLC,Bristol,MA,41.751347,-71.11454
60739,DSM Solar,56997,Marina Energy LLC,Warren,NJ,40.843699,-75.06516
6074,Greenwood (MO),56211,KCP&L Greater Missouri Operations Co,Jackson,MO,38.8615,-94.2982
60740,Pittsgrove Solar,56997,Marina Energy LLC,Salem,NJ,39.539042,-75.17934
60741,Old Midville Solar,58871,Citizens Enterprises Corporation,Jenkins,GA,32.820676,-81.98176
60742,Argonne National Laboratory CHP,60444,Argonne National Laboratory,DuPage,IL,41.716534,-87.97061
60743,"Rattlesnake Power, LLC",60443,"Rattlesnake Power, LLC",McCulloch,TX,31.360331,-99.55136
60744,SEPV Imperial Dixieland West,60445,"SEPV Imperial, LLC",Imperial,CA,32.79411,-115.7793
60745,SEPV Imperial Dixieland East,60445,"SEPV Imperial, LLC",Imperial,CA,32.792038,-115.7734
60746,Silvi Gibraltar Rock,60447,KDC Solar GRQ LLC,Somerset,NJ,40.450916,-74.71708
60747,Seabrook Village,60446,KDC Solar Bergen 1,Monmouth,NJ,40.234177,-74.08723
60748,Simcoe Solar,60448,Simcoe Solar,Elmore,ID,43.288439,-115.9554
