Plant Id,Plant Name,Entity Id,Entity Name,County,State,Latitude,Longitude
57244,Kit Carson Windpower,56612,Kit Carson Windpower LLC,Kit Carson,CO,39.3383,-102.3533
57245,Solar Photovoltaic Project #26,17609,Southern California Edison Co,San Bernardino,CA,34.131214,-117.4253
57246,Solar Photovoltaic Project #27,17609,Southern California Edison Co,San Bernardino,CA,34.131111,-117.4217
57247,Solar Photovoltaic Project #28,17609,Southern California Edison Co,San Bernardino,CA,34.094167,-117.2742
57248,Welcome Wind Turbine,6258,Federated Rural Electric Assn,Martin,MN,43.6825,-94.5892
57249,Renewable Energy Services of Ohio,55920,Bio-Gas Technologies LTD,Erie,OH,41.3362,-82.602
57250,Earthmovers LFGTE,40211,"Wabash Valley Power Assn, Inc",Elkhart,IN,41.622942,-85.97516
57251,Lakota Wind Wind Farm,9425,Iowa Lakes Electric Coop,Kossuth,IA,43.3839,-94.1475
57252,Iowa Lakes Superior Wind Farm,9425,Iowa Lakes Electric Coop,Dickinson,IA,43.445,-94.98028
57253,MA Military Reservation Wind Project,56619,Air Force Civil Engineer Center,Barnstable,MA,41.6647,-70.5942
57254,Victor Valley CC CPV Solar,56618,Victor Valley Community College District,San Bernardino,CA,34.48017,-117.2579
57255,Trishe Wind Minnesota,56633,Trishe Wind Minnesota,Kandiyohi,MN,45.153889,-94.88111
57256,PA Solar Park,56769,Consolidated Edison Development Inc.,Carbon,PA,40.860142,-75.85221
57257,Iowa Lakes Community College Wind Farm,56617,Iowa Lakes Community College,Emmet,IA,43.385347,-94.81566
57258,Texico Wind Ranch LP,56630,Texico Wind LP,Curry,NM,34.36,-103.0667
57259,Lubbock Wind Ranch,56629,Lubbock Wind LLC,Lubbock,TX,33.5697,-101.7653
57260,Cedro Hill Wind LLC,59883,NRG Energy Gas & Wind Holdings Inc,Webb,TX,27.576111,-98.90528
57261,Taloga Wind LLC,59883,NRG Energy Gas & Wind Holdings Inc,Dewey,OK,35.855556,-98.96833
57262,Laredo Ridge Wind LLC,59883,NRG Energy Gas & Wind Holdings Inc,Boone,NE,41.880278,-98.02389
57263,Little Pringle I Wind Farm,56627,DeWind Co.,Hutchinson,TX,35.964272,-101.5402
57264,Little Pringle II Wind Farm,56627,DeWind Co.,Hutchinson,TX,35.924858,-101.5414
57265,Dorchester Solar Site,11804,Massachusetts Electric Co,Suffolk,MA,42.300802,-71.04717
57267,Marsh Landing Generating Station,56635,NRG Marsh Landing LLC,Contra Costa,CA,38.016944,-121.765
57268,Chestnut Flats Wind Farm,57170,"EDF Renewable Asset Holdings, Inc.",Blair,PA,40.522846,-78.47692
57269,Haverhill Solar Power Project,11804,Massachusetts Electric Co,Essex,MA,42.781056,-71.09256
57270,NEDC Solar Site,11804,Massachusetts Electric Co,Worcester,MA,42.105237,-71.70298
57274,Grant County Wind LLC,56642,Grant County Wind LLC,Grant,MN,45.8033,-95.8844
57275,Crescent Dunes Solar Energy,56641,Tonopah Solar Energy LLC,Nye,NV,38.238889,-117.3636
57278,Crofton Bluffs Wind LLC,59883,NRG Energy Gas & Wind Holdings Inc,Knox,NE,42.698333,-97.58
57280,Aqua Ingrams Mill,56645,Aqua America Inc,Chester,PA,39.9647,-75.6578
57281,OREG 3 Inc,34691,Ormat Nevada Inc,Martin,MN,43.76,-94.7514
57282,Alta Wind Energy Center I,60015,NRG Yield LLC,Kern,CA,35.033725,-118.3534
57283,Flat Water Wind Farm LLC,56625,Flat Water Wind Farm LLC,Richardson,NE,40.0011,-95.9289
57284,Minonk Wind Farm,59050,Algonquin Power Co,Woodford,IL,40.888611,-88.99722
57285,Sandy Ridge Wind Farm,59050,Algonquin Power Co,Blair,PA,40.729207,-78.28735
57286,OU Spirit Wind Farm,14063,Oklahoma Gas & Electric Co,Woodward,OK,36.333803,-99.48014
57287,Hardscrabble Wind Power LLC,15399,Avangrid Renewables LLC,Herkimer,NY,43.112222,-74.87889
57289,Big Blue,58150,Big Blue Wind Farm LLC (MN),Faribault,MN,43.612222,-94.19194
57290,Northern Colorado Wind LLC,56653,Northern Colorado Wind LLC,Logan,CO,40.9881,-102.8969
57291,Alta Wind Energy Center II,60015,NRG Yield LLC,Kern,CA,35.023889,-118.2953
57292,Alta Wind Energy Center III,60015,NRG Yield LLC,Kern,CA,35.023889,-118.2953
57293,Alta Wind Energy Center IV,60015,NRG Yield LLC,Kern,CA,35.008611,-118.2422
57294,Alta Wind Energy Center V,60015,NRG Yield LLC,Kern,CA,35.008611,-118.2422
57295,Alpine Solar,59397,NRG Solar Alpine,Los Angeles,CA,34.7892,-118.5047
57296,Carleton College,56654,Carleton College,Rice,MN,44.461908,-93.15639
57298,Cedar Hills,60736,"Bio Energy Washington, LLC",King,WA,47.455833,-122.0428
57299,Dunlap,14354,PacifiCorp,Carbon,WY,42.043611,-106.1603
57300,Criterion,56661,Criterion Power Partners LLC,GARRETT,MD,39.4047,-79.29
57301,Dutch Wind Energy,56665,Dutch Energy Corporation,Riverside,CA,33.8942,-116.5603
57302,Garnet Wind Energy Center,56664,Garnet Energy Corporation,Riverside,CA,33.9053,-116.5825
57303,Loraine Windpark Project LLC,56667,Loraine Windpower Project,Mitchell,TX,32.4375,-100.7444
57305,Adelanto Solar Project,11208,Los Angeles Department of Water & Power,San Bernardino,CA,34.550833,-117.4353
57306,Pine Tree Solar Project,11208,Los Angeles Department of Water & Power,Kern,CA,35.229635,-118.1957
57308,Maclay Solar Project,11208,Los Angeles Department of Water & Power,Los Angeles,CA,34.319722,-118.4308
57309,Pacific Cruise Ship Terminals Berth 93,11208,Los Angeles Department of Water & Power,Los Angeles,CA,33.7331,-118.2772
57310,1420 Coil Av #C,57320,Konoike Pacific,Los Angeles,CA,33.794283,-118.2414
57311,Occidental College Solar Project,11208,Los Angeles Department of Water & Power,Los Angeles,CA,34.1283,-118.2069
57313,Metro Support Services Center Solar,57275,Metropolitan Transportation Authority,Los Angeles,CA,34.0578,-118.2297
57314,Los Angeles Harbor College,57276,Los Angeles Community College District,Los Angeles,CA,33.783102,-118.2849
57315,Cedar Point Wind,56662,Cedar Point LLC,Lincoln,CO,39.421787,-103.6781
57317,San Luis Valley Solar Ranch,15399,Avangrid Renewables LLC,Alamosa,CO,37.694535,-105.9276
57318,Copper Crossing Solar LLC,15399,Avangrid Renewables LLC,Gila,AZ,33.160601,-111.484
57319,Big Horn Wind II,15399,Avangrid Renewables LLC,Klickitat,WA,45.9192,-120.3039
57320,Juniper Canyon I Wind Project,15399,Avangrid Renewables LLC,Klickitat,WA,45.9215,-120.2355
57321,Mayberry Solar LLC,56663,Mayberry Solar LLC,Surry,NC,36.476667,-80.60111
57322,Mont Belvieu Cogeneration Unit,56672,Targa Co-Generation LLC,Chambers,TX,29.838138,-94.90066
57323,Sierra SunTower Solar Gen Station,56679,Sierra SunTower LLC,Los Angeles,CA,34.7306,-118.135
57325,FPL Energy Illinois Wind LLC,56678,FPL Energy Illinois Wind LLC,DeKalb,IL,41.7678,-88.8867
57326,Sunray Wind I,56680,Diamond Shamrock Refining Company LP,Moore,TX,35.9454,-101.9005
57327,Top of the World Windpower Project,56682,Duke Energy Top Of the World WindPower,Converse,WY,42.9258,-105.7872
57330,Kent County Wastewater Treatment Solar,56681,Kent County Levy Court Dept of Pub Work,Kent,DE,38.993056,-75.4375
57331,Mojave Solar Project,56660,Mojave Solar LLC,San Bernardino,CA,35.017717,-117.3391
57332,Crossroads Wind Farm,14063,Oklahoma Gas & Electric Co,Dewey,OK,36.035,-98.72222
57333,Leaning Juniper Wind Power II,15399,Avangrid Renewables LLC,Gilliam,OR,45.651,-120.2598
57334,DE Solar 10240 Old Dowd Rd,5416,"Duke Energy Carolinas, LLC",Mecklenburg,NC,35.2458,-80.9967
57335,DE Solar 657 Brigham Rd,5416,"Duke Energy Carolinas, LLC",Guilford,NC,36.1053,-79.9692
57336,DE Solar 1725 Drywall Dr,5416,"Duke Energy Carolinas, LLC",Gaston,NC,35.3261,-80.9967
57337,Dover Sun Park,56673,White Oak Solar Energy LLC,Kent,DE,39.183611,-75.50444
57338,Roadrunner Solar,59400,NRG Solar Roadrunner,Dona Ana,NM,31.792778,-106.6733
57340,Panoche Valley Solar Farm,56769,Consolidated Edison Development Inc.,San Benito,CA,36.78005,-120.7298
57341,Silver Lake Solar Farm,15477,Public Service Elec & Gas Co,Middlesex,NJ,40.494804,-74.39951
57342,White Oak Energy LLC,56684,White Oak Energy LLC,McLean,IL,40.590833,-89.04667
57343,Cargill B6 Biofactory,60524,"Pico Energy, LLC",Gooding,ID,42.7167,-114.6167
57344,Cargill Dry Creek Biofactory,58992,"AgPower DCD, LLC",Twin Falls,ID,42.424937,-114.2292
57345,Cargill Kettle Butte Biofactory,60582,Kettle Butte Dairy LLC,Jefferson,ID,43.631944,-112.2797
57346,Elk City LLC,56683,Elk City LLC,Roger Mills,OK,35.4642,-99.8983
57347,Baldwin Wind LLC,56688,Baldwin Wind LLC,Burleigh,ND,47.1133,-100.7086
57348,CityCenter Central Plant Cogen Units,56687,CityCenter Land LLC,Clark,NV,36.1039,-115.1794
57349,Garrison Energy Center LLC,56691,Garrison Energy Center LLC,Kent,DE,39.187195,-75.4994
57350,Portsmouth Wind Turbine,56690,Town of Portsmouth,,,41.6144,-71.2514
57351,Uilk Wind LLC,56689,RENEW Energy Inc,Pipestone,MN,43.9811,-96.4269
57352,Trenton Solar Farm,15477,Public Service Elec & Gas Co,Mercer,NJ,40.2314,-74.7539
57353,Thermo No 1,56694,Thermo No 1 BE 01 LLC,,,38.160653,-113.1945
57353,Thermo No 1,56694,Thermo No 1 BE 01 LLC,Beaver,UT,38.160653,-113.1945
57354,Fox Island Wind LLC,56693,Fox Island Wind LLC,Knox,ME,44.094167,-68.86583
57356,Henrico,55938,Industrial Power Generating Company LLC,Henrico,VA,37.6788,-77.5678
57357,Red Mesa Wind LLC,56698,Red Mesa Wind LLC,Sandoval,NM,35.2689,-107.3828
57358,Keenan II Renewable Energy Co LLC,56699,CPV Keenan II Renewable Energy Co LLC,Woodward,OK,36.276111,-99.49083
57359,Avenal Park,56700,Avenal Solar Holdings LLC,Kings,CA,35.989722,-120.11
57360,Sun City Project LLC,56700,Avenal Solar Holdings LLC,Kings,CA,35.983056,-120.1103
57361,Sand Drag LLC,56700,Avenal Solar Holdings LLC,Kings,CA,35.982778,-120.1103
57362,Morgantown Solar Park,56701,The Hankin Group,Berks,PA,40.152069,-75.86592
57363,510 REPP One,56702,510 REPP One LLC,Northampton,NC,36.4972,-77.6058
57364,Siphon Drop Power Plant,56707,Yuma County Water User's Association,Imperial,CA,32.7792,-114.6344
57365,MP Durham LLC,56703,MP Durham LLC,,,36.0311,-78.86
57365,MP Durham LLC,56703,MP Durham LLC,Durham,NC,36.0311,-78.86
57366,MP Wayne LLC,56704,MP Wayne LLC,Wayne,NC,35.2889,-78.0703
57367,Pocono Solar Project,56705,Pocono International Raceway Inc,Monroe,PA,41.061022,-75.51492
57368,Cogentrix of Alamosa,56696,Alamosa Operating Services LLC,Alamosa,CO,37.598579,-105.9558
57369,Questa Solar Facility,56706,Chevron Technology Ventures,Taos,NM,36.716944,-105.6094
57372,Bellevue Solar Project,57170,"EDF Renewable Asset Holdings, Inc.",Yamhill,OR,45.112222,-123.2347
57373,Agua Caliente Solar Project,59396,Agua Caliente Solar,Yuma,AZ,32.9774,-113.4945
57374,Lakefield Wind Project LLC,57170,"EDF Renewable Asset Holdings, Inc.",Jackson,MN,43.675,-95.15667
57375,Adams Wind Generations LLC,56713,Adams Wind Generations LLC,Meeker,MN,44.916944,-94.73556
57376,Jersey Valley Geothermal Power Plant,34691,Ormat Nevada Inc,Pershing,NV,40.1808,-117.4739
57377,Greater Sandhill I,56720,Greater Sandhill I LLC,Alamosa,CO,37.685467,-105.8909
57378,AV Solar Ranch One,56722,AV Solar Ranch 1 LLC,Los Angeles,CA,34.780278,-118.4244
57379,Dry Lake Wind II LLC,15399,Avangrid Renewables LLC,Navajo,AZ,34.6062,-110.1734
57380,New England Wind LLC,15399,Avangrid Renewables LLC,Berkshire,MA,42.7297,-73.0236
57381,Linden Solar Farm,15477,Public Service Elec & Gas Co,Union,NJ,40.62,-74.2144
57382,Yardville Solar Farm,15477,Public Service Elec & Gas Co,Mercer,NJ,40.168811,-74.65672
57383,WEA Texas Bayonne,15477,Public Service Elec & Gas Co,Hudson,NJ,40.6772,-74.0919
57384,Matrix Buildings A&B (Perth Amboy) Solar,15477,Public Service Elec & Gas Co,Middlesex,NJ,40.534393,-74.27
57385,Community Wind North LLC,59883,NRG Energy Gas & Wind Holdings Inc,Lincoln,MN,44.245556,-96.40639
57386,Ridgewind,56715,Ridgewind Power Partners LLC,Pipestone,MN,44.018889,-96.06528
57387,Ashtabula Wind III LLC,56727,Ashtabula Wind III LLC,Barnes,ND,47.1242,-97.8956
57390,GSK York RDC Solar Facility,56732,GlaxoSmithKline Consumer Healthcare L P,York,PA,40.043856,-76.73547
57392,UASTP I,24211,Tucson Electric Power Co,Pima,AZ,32.096973,-110.8106
57393,Big Sky Dairy Digester,56718,DF-AP #1 LLC,Gooding,ID,42.8656,-114.7914
57394,Genesis Solar Energy Project,56723,Genesis Solar LLC,Riverside,CA,33.665,-114.9981
57396,Danielson Wind Farms LLC,56721,Danielson Wind Farms LLC,Kandiyohi,MN,45.071667,-94.75222
57397,Dow Jones South Brunswick Solar,56728,Dow Jones & Co,Middlesex,NJ,40.369772,-74.58685
57399,Cannelton Hydroelectric Plant,40577,"American Mun Power-Ohio, Inc",Hancock,KY,37.899722,-86.70583
57400,Smithland Hydroelectric Plant,40577,"American Mun Power-Ohio, Inc",Livingston,KY,37.169636,-88.41952
57401,Willow Island Hydroelectric Plant,40577,"American Mun Power-Ohio, Inc",Pleasants,WV,39.35776,-81.31795
57402,Taylorsville Solar LLC,56798,Taylorsville Solar LLC,Alexander,NC,35.909074,-81.1525
57403,Northwest Regional,54842,WM Renewable Energy LLC,Maricopa,AZ,33.681944,-112.4767
57404,Oneida Herkimer,54842,WM Renewable Energy LLC,Oneida,NY,43.462222,-75.41833
57405,Eagle Valley (MI),54842,WM Renewable Energy LLC,Oakland,MI,42.7225,-83.26306
57406,Prairie View IL,54842,WM Renewable Energy LLC,Will,IL,41.343056,-88.10139
57408,Prairie Bluff,54842,WM Renewable Energy LLC,Chickasaw,MS,33.954444,-88.9925
57409,West Camden,54842,WM Renewable Energy LLC,Benton,TN,36.057892,-88.14197
57410,Geneva,54842,WM Renewable Energy LLC,Ashtabula,OH,41.795,-80.91
57411,Mahoning,54842,WM Renewable Energy LLC,Mahoning,OH,40.914444,-80.58611
57412,Knouse Solar Project 1,56741,Knouse Food Cooperative Inc,Cumberland,PA,40.0264,-77.2344
57414,Notus Wind 1,56742,Notus Clean Energy LLC,Barnstable,MA,41.6083,-70.6089
57415,Sherbino II,55963,AE Power Services LLC,Pecos,TX,30.772575,-102.5058
57417,Elk Wind Farm,60423,RPMA Operations LLC,Delaware,IA,42.583889,-91.37083
57419,RPI Fuel Cell LLC,56748,RP1 Fuel Cell LLC,San Bernardino,CA,34.028611,-117.6014
57420,UTS SJ1 LLC,56749,UTS SJ1 LLC,Santa Clara,CA,37.433056,-121.9419
57421,Gratiot Wind Park,5109,DTE Electric Company,Gratiot,MI,43.433889,-84.4975
57422,Yolo County Solar Project,56751,Yolo County of,Yolo,CA,38.659722,-121.7294
57424,Buffalo Ridge II LLC,15399,Avangrid Renewables LLC,Brookings,SD,44.5281,-96.6267
57425,Double A Digester,56753,AgPower Jerome LLC,Jerome,ID,42.853942,-114.4719
57427,Ryegrass Windfarm,57337,Aegis Renewables LLC,Elmore,ID,43.037147,-115.4397
57428,Hammett Hill Windfarm,57337,Aegis Renewables LLC,Elmore,ID,43.006133,-115.4633
57429,Mainline Windfarm,57337,Aegis Renewables LLC,Elmore,ID,43.04835,-115.4129
57430,Desert Meadow Windfarm,57337,Aegis Renewables LLC,Elmore,ID,43.056622,-115.452
57431,Cold Springs Windfarm,57337,Aegis Renewables LLC,Elmore,ID,43.028056,-115.4005
57432,Oak Glen Wind Farm,12667,Minnesota Municipal Power Agny,Steele,MN,43.920556,-93.14056
57433,Bellefontaine Gas Producers LLC,56756,Bellefontaine Gas Producers LLC,Logan,OH,40.410751,-83.71788
57434,Valley View Transmission LLC,56769,Consolidated Edison Development Inc.,Murray,MN,43.902753,-96.02174
57435,Solar Star North Carolina II LLC,56758,Solar Star North Carolina II LLC,Hertford,NC,36.425,-77.064
57436,Davidson Gas Producers LLC,56760,Davidson Gas Producers LLC,Davidson,NC,35.841299,-80.18346
57437,Juniper Ridge Hydroelectric Project,3220,Central Oregon Irrigation Dist,Deschutes,OR,44.142698,-121.2697
57438,"Solar Park Gainesville, LLC",61203,"Solar Park Gainesville, LLC",Alachua,FL,29.700407,-82.33783
57439,California Valley Solar Ranch,56762,"NRG Renew Operation & Maintenance, LLC",San Luis Obispo,CA,35.323739,-119.9166
57441,Solar Photovoltaic Project #42,17609,Southern California Edison Co,Tulare,CA,36.028056,-119.0747
57442,Silver State Solar Power North,58720,Enbridge,Clark,NV,35.793056,-115.3503
57443,Pine Tree Acres WM LFGTE,54842,WM Renewable Energy LLC,Macomb,MI,42.765,-82.74556
57444,Two Ponds Windfarm,57337,Aegis Renewables LLC,Elmore,ID,43.033781,-115.4826
57446,McGinness Hills,34691,Ormat Nevada Inc,Lander,NV,39.5911,-116.9119
57447,Laurel Mountain,19740,AES Wind Generation Inc,Barbour,WV,39.0072,-79.8866
57448,Pilesgrove,56769,Consolidated Edison Development Inc.,Salem,NJ,39.613028,-75.30948
57449,Blue Creek Wind Project,15399,Avangrid Renewables LLC,Van Wert,OH,40.931515,-84.56182
57451,Tuscarora Geothermal Power Plant,34691,Ormat Nevada Inc,Elko,NV,41.4828,-116.1511
57455,NRG Solar Borrego I,57271,NRG Solar Borrego I,San Diego,CA,33.298889,-116.3508
57456,San Emidio,56764,USG Nevada LLC,Washoe,NV,40.380556,-119.3997
57457,Seneca Sustainable Energy LLC,56776,Seneca Sustainable Energy LLC,Lane,OR,44.116306,-123.179
57458,145 Talmadge Solar,56777,Avidan Energy Solutions,Middlesex,NJ,40.535787,-74.39127
57459,Mountain View IV,19740,AES Wind Generation Inc,Riverside,CA,33.8816,-116.5527
57460,Caltech Central,56778,Bloom Energy 2009 PPA,Los Angeles,CA,34.1358,-118.1267
57461,"Martins Creek Solar NC, LLC",56779,"Martins Creek Solar NC, LLC",Cherokee,NC,35.020415,-84.01568
57462,Napoleon Solar I,56780,Enfinity BNB Napoleon Solar LLC,Henry,OH,41.388431,-84.09584
57463,Bishop Hill Energy LLC,59139,SunEdison LLC,Henry,IL,41.215278,-90.12083
57465,Romark PA Solar,56783,Romark Logistics of PA Inc.,Luzerne,PA,40.936111,-76.03889
57466,Blue Ridge Landfill,57249,EPP Renewable Energy,Franklin,PA,39.961944,-77.56111
57467,Westervelt Moundville Cogen,56785,The Westervelt Co,Hale,AL,32.960714,-87.65542
57468,Crystal Lake 3 LLC,56786,Crystal Lake 3 LLC,Winnebago,IA,43.3192,-93.8836
57469,Garden Wind LLC,56787,Garden Wind LLC,Hardin,IA,42.224436,-93.37363
57470,Marlboro Mill,56788,Domtar Paper Company Bennettsville,Marlboro,SC,34.605,-79.785
57471,Murray Hill Solar,56769,Consolidated Edison Development Inc.,Union,NJ,40.684444,-74.40444
57472,TBE-Montgomery LLC,56789,TBE Montgomery LLC,Orange,NY,41.4885,-74.2262
57473,Dartmouth Solar,56769,Consolidated Edison Development Inc.,Bristol,MA,41.715804,-70.97445
57474,Ralls Wind Farm,56790,Ralls Wind Farm LLC,Crosby,TX,33.661111,-101.39
57475,John L. Featherstone Plant,58465,"Green States Energy, Inc.",Imperial,CA,33.204635,-115.5733
57476,TSGT Mobile Generator #15,30151,"Tri-State G & T Assn, Inc",Rio Arriba,NM,36.934,-106.9865
57480,Highwood Generating Station,56774,S Montana Elec Gen and Trans Coop Inc,,,47.551667,-111.0344
57481,Chittenden County Solar Partners,56795,Chittenden County Solar Partners LLC,Chittenden,VT,44.436111,-73.14528
57482,"Sentinel Energy Center, LLC",56887,CPV Sentinel LLC,Riverside,CA,33.934167,-116.5714
57483,Mariposa Energy Project,49981,Diamond Generating Corporation,Alameda,CA,37.789167,-121.6019
57484,Manzana Wind LLC,15399,Avangrid Renewables LLC,Kern,CA,34.9349,-118.4612
57485,Flemington Solar,56769,Consolidated Edison Development Inc.,Hunterdon,NJ,40.483888,-74.85667
57486,Frenchtown I Solar,56769,Consolidated Edison Development Inc.,Hunterdon,NJ,40.521667,-75.01222
57487,Frenchtown II Solar,56769,Consolidated Edison Development Inc.,Hunterdon,NJ,40.514444,-74.97694
57488,Lebanon Solar,56769,Consolidated Edison Development Inc.,Hunterdon,NJ,40.675833,-74.91222
57489,Oak Grove Power Producers,61038,"Cube District Energy, LLC",Crawford,KS,37.6297,-94.6414
57490,Imperial Solar Energy Center South,56819,CSOLAR IV South LLC,Imperial,CA,32.663289,-115.6583
57491,Imperial Solar Energy Center West,57260,CSOLAR IV West LLC,Imperial,CA,32.772225,-115.7793
57492,Sampson County Disposal,56814,Black Creek Renewable Energy LLC,Sampson,NC,34.9856,-78.4625
57493,Settlers Trail Wind Farm LLC,56215,E ON Climate Renewables N America LLC,Iroquois,IL,40.694444,-87.57083
57494,Masser Farms Realty Solar,56816,Masser Farms Realty Ltd,Schuylkill,PA,40.640556,-76.60542
57496,Tieton Dam Hydro Electric Project,2507,City of Burbank Water and Power,Yakima,WA,46.658,-121.1287
57497,Stroud Solar Station,14328,Pacific Gas & Electric Co.,Fresno,CA,36.531389,-120.1069
57498,Five Points Solar Station,14328,Pacific Gas & Electric Co.,Fresno,CA,36.400278,-120.1033
57499,Westside Solar Station,14328,Pacific Gas & Electric Co.,Fresno,CA,36.378726,-120.1249
57500,Laurel Wind Farm,12341,MidAmerican Energy Co,Marshall,IA,41.883333,-92.93333
57501,Rolling Hills Wind Farm,12341,MidAmerican Energy Co,Cass,IA,41.1973,-94.7744
57502,Perdido,7801,Gulf Power Co,Escambia,FL,30.57,-87.39
57504,TECO CHP-1,56826,Texas Medical Center Central,Harris,TX,29.703454,-95.39832
57505,Monroe Generating Station,13630,North Carolina Mun Power Agny #1,Union,NC,34.985814,-80.50604
57506,FRV SI Transport Solar LP,56827,FRV SI Transport Solar LP,Sacramento,CA,38.4869,-121.3911
57507,RV CSU Power II LLC,56828,RV CSU Power II LLC,Larimer,CO,40.592841,-105.1471
57508,McKinney LFG,56829,McKinney LFG LLC,,,33.171094,-96.61231
57509,Carson Solar I,56830,Carson Solar 1 LLC,El Paso,CO,38.7228,-104.7817
57513,Central Ohio BioEnergy Plant #1,56833,Central Ohio BioEnergy,,,39.9017,-83.0222
57514,Ocotillo Express LLC,56545,Pattern Operators LP,Imperial,CA,32.752778,-116.0447
57515,Walnut Creek Energy Park,59980,NRG Walnut Creek LLC,Los Angeles,CA,34.008709,-117.9449
57516,KODE Novus I,56627,DeWind Co.,Texas,OK,36.543889,-101.3936
57517,DeWind Frisco,56627,DeWind Co.,Hansford,TX,36.498514,-101.6053
57519,Trexlertown Solar Array North and South,56856,Trexlertown Solar Array North and South,Lehigh,PA,40.556211,-75.59387
57520,Trinity Hills,55963,AE Power Services LLC,Young,TX,33.383611,-98.71194
57521,Giffen,14328,Pacific Gas & Electric Co.,Fresno,CA,36.530278,-120.3161
57522,Cantua Solar Station,14328,Pacific Gas & Electric Co.,Fresno,CA,36.425085,-120.3435
57523,Huron Solar Station,14328,Pacific Gas & Electric Co.,Fresno,CA,36.181389,-120.0306
57524,Roger Road WWTP,56857,SunE M5C Holdings LLC,Pima,AZ,32.2894,-111.0331
57525,Kapaa Photovoltaic Project,56863,Kapaa Solar LLC,Kauai,HI,22.080416,-159.3316
57526,North Hurlburt Wind LLC,56865,Caithness Shepherds Flat LLC,Gilliam,OR,45.731611,-120.0835
57529,Kawailoa Wind,56868,Kawailoa Wind LLC,Honolulu,HI,21.610278,-158.0408
57530,Palouse,60453,Novatus Energy,Whitman,WA,47.155833,-117.3644
57531,Bingham Wind,60453,Novatus Energy,Piscataquis,ME,45.103333,-69.76194
57534,Solar Photovoltaic Project #32,17609,Southern California Edison Co,San Bernardino,CA,34.031667,-117.5719
57535,Solar Photovoltaic Project #33,17609,Southern California Edison Co,San Bernardino,CA,34.0325,-117.5692
57540,Solar Photovoltaic Project #44,17609,Southern California Edison Co,Riverside,CA,33.839167,-117.2208
57544,California State University San Bernardi,17609,Southern California Edison Co,San Bernardino,CA,34.185833,-117.3242
57547,Winona County Wind LLC,56874,Winona County Wind LLC,Winona,MN,44.1125,-91.92472
57549,South Hurlburt Wind LLC,56865,Caithness Shepherds Flat LLC,Gilliam,OR,45.706262,-120.08
57550,Horseshoe Bend Wind LLC,56865,Caithness Shepherds Flat LLC,Gilliam,OR,45.58555,-120.0082
57551,Garland Canal Power Plant,56880,Shoshone Irrigation District,Park,WY,44.7264,-108.8644
57552,Oakley Generating Station,56872,Contra Costa Generating Station LLC,Contra Costa,CA,38.01,-121.7475
57553,Shirley Wind,56891,Shirley Wind LLC,Brown,WI,44.3481,-87.9278
57554,AFA Solar Farm,56892,Solar Star Colorado II LLC,El Paso,CO,38.957901,-104.8066
57555,Pio Pico Energy Center,56895,Pio Pico Energy Center LLC,SAN DIEGO,CA,32.573889,-116.9178
57556,La Senita,19728,"UNS Electric, Inc",Mohave,AZ,35.241675,-114.0046
57557,Sunnyvale City of WPCP,56898,Sunnyvale City of WPCP,Santa Clara,CA,37.4194,-122.0153
57559,Sunset Reservoir North Basin,56902,"RE SFCity1, LP",San Francisco,CA,37.750894,-122.4818
5756,KMS Joliet Power Partners LP,50098,DTE Biomass,,,41.499167,-88.14639
57560,Chino Solar Valley,803,Arizona Public Service Co,Yavapai,AZ,34.71843,-112.429
57561,Cotton Center Solar,803,Arizona Public Service Co,Maricopa,AZ,33.034722,-112.6617
57562,Paloma Solar,803,Arizona Public Service Co,Maricopa,AZ,33.021111,-112.6614
57563,Hyder Solar,803,Arizona Public Service Co,Yuma,AZ,33.02566,-113.344
57564,Algonquin Power Sanger LLC,56905,Algonquin Power Sanger LLC,,,36.6842,-119.5522
57564,Algonquin Power Sanger LLC,56905,Algonquin Power Sanger LLC,Fresno,CA,36.6842,-119.5522
57565,"RP-Orlando, LLC",56904,"RP-Orlando, LLC",Orange,FL,28.488889,-81.18222
57566,GE 1.7-100 Prototype,58270,GE Wind Energy LLC,,,35.155278,-118.3694
57566,GE 1.7-100 Prototype,58270,GE Wind Energy LLC,Kern,CA,35.155278,-118.3694
57567,Albuquerque Solar Energy Center,59300,PNM Resources,Bernalillo,NM,35.168957,-106.6001
57568,Record Hill Wind,56909,Record Hill Wind LLC,Oxford,ME,44.633611,-70.62778
57570,Cooper Farms VW Project,56912,Cooper Hatchery Inc.,Van Wert,OH,40.905833,-84.57028
57571,Los Lunas Solar Energy Center,59300,PNM Resources,Valencia,NM,34.833136,-106.7724
57573,CCCSD Wastewater Treatment Plnt,56914,Central Contra Costa Sanitary District,Contra Costa,CA,37.9978,-122.0697
57574,ETS Ewing Solar Facility,56915,"Solar Star New Jersey IV, LLC",Mercer,NJ,40.281801,-74.79364
57575,Deming Solar Energy Center,59300,PNM Resources,Luna,NM,32.165833,-107.7506
57576,Las Vegas Solar Energy Center,59300,PNM Resources,San Miguel,NM,35.643333,-105.2067
57577,Alamogordo Solar Energy Center,59300,PNM Resources,Otero,NM,32.86571,-105.9998
57578,PaTu Wind Farm LLC,56916,PaTu Wind Farm LLC,Sherman,OR,45.613061,-120.6169
57579,Robert O Schulz Solar Farm,17573,South San Joaquin Irr District,Stanislaus,CA,37.8583,-120.8917
57580,Broadridge Cogen,56917,Broadridge Customer Communications,El Dorado,CA,38.6183,-121.0564
57581,Allenwood,57249,EPP Renewable Energy,Lycoming,PA,41.151111,-76.91778
57582,Lycoming County,57249,EPP Renewable Energy,Lycoming,PA,41.151111,-76.91778
57583,Battery Energy Storage System,7353,Golden Valley Elec Assn Inc,Fairbanks North Star,AK,64.8167,-147.725
57584,University of California San Diego,56918,University of California San Diego,San Diego,CA,32.8747,-117.2392
57585,Oxnard Paper Mill,58264,"New-Indy, Oxnard LLC",Ventura,CA,34.1414,-119.1831
57586,Shiloh III Wind Project LLC,57170,"EDF Renewable Asset Holdings, Inc.",Solano,CA,38.169444,-121.8469
57587,The Charleston Clean Energy Facility,56921,Charleston Clean Energy LLC,,,38.309167,-81.62222
57588,Matrix Stults Road Solar Facility,15477,Public Service Elec & Gas Co,Middlesex,NJ,40.3622,-74.4797
57589,Long Island Solar Farm LLC,56924,Long Island Solar Farm LLC,Suffolk,NY,40.861111,-72.84778
57590,"Minco Wind I, LLC",56925,"FPLE Wind, LLC",Grady,OK,35.280278,-97.97556
