Plant Id,Plant Name,Entity Id,Entity Name,County,State,Latitude,Longitude
50414,Penacook Upper Falls Hydro,24793,Briar-Hydro Associates,Merrimack,NH,43.283208,-71.60083
50416,Tannery Island Power,18436,"Ampersand Tannery Island Hydro, LLC",Jefferson,NY,43.98,-75.6131
50419,Ware Energy,20096,Ware Energy Corp,,,42.2347,-72.8783
50421,Orchard Avenue 1,21086,Yakima-Tieton Irrigation Dist,Yakima,WA,46.596413,-120.6775
50423,Cowiche,21086,Yakima-Tieton Irrigation Dist,Yakima,WA,46.692628,-120.7372
50424,Duluth Paper Mill,55965,Verso Corporation,St Louis,MN,46.734957,-92.16209
50425,Kraft Foods Atlantic Gelatin,24591,Kraft Foods Global Inc,,,42.4769,-71.115
50426,Warm Springs Forest Products,19984,Warm Springs Forest Prod Indst,,,44.764843,-121.2347
50427,Bronx Zoo,13487,New York Zoological Society,Bronx,NY,40.844114,-73.87689
50428,Paper Pak Industries,14387,Paper Pak Industries,,,34.095,-117.7639
50431,University of Michigan,19588,University of Michigan,,,42.281167,-83.73462
50431,University of Michigan,19588,University of Michigan,Washtenaw,MI,42.281167,-83.73462
50433,Ada Dam,17976,STS HydroPower Ltd-Ada Dam,Kent,MI,42.950642,-85.48594
50435,Sugarloaf Hydro Plant,18194,STS Hydropower Ltd,Lake,CO,39.252672,-106.3748
50436,Cascade Dam,18415,STS HydroPower Ltd-Cascade Dam,Kent,MI,42.909408,-85.49888
50437,French Landing Dam,18419,STS HydroPower Ltd-French LDam,Wayne,MI,42.214264,-83.44069
50438,S D Warren Muskegon,16719,S D Warren Co,,,43.213889,-85.70028
50439,Oconto Falls Lower,42662,N E W Hydro LLC,Oconto,WI,44.8719,-88.1439
50447,S D Warren Westbrook,16721,S D Warren Co.- Westbrook,Cumberland,ME,43.684857,-70.35315
50449,Indeck Silver Springs Energy Center,9245,Indeck-Energy Serv Silver Spg,Wyoming,NY,42.6544,-78.0772
50450,Indeck Oswego Energy Center,9244,Indeck-Oswego Ltd Partnership,Oswego,NY,43.471745,-76.49347
50451,Indeck Yerkes Energy Center,9243,Indeck-Yerkes Ltd Partnership,Erie,NY,42.9671,-78.9182
50456,Procter & Gamble Cincinnati Plant,15400,Procter & Gamble Co,Hamilton,OH,39.175,-84.5042
50458,Indeck Corinth Energy Center,9263,Indeck-Corinth Ltd Partnership,Saratoga,NY,43.25,-73.8125
50459,NRG Ilion LP,9255,Indeck Operations Inc,,,43.0125,-75.03333
50461,Cheboygan,7857,Great Lakes Tissue Co,Cheboygan,MI,45.637537,-84.48139
50463,Procter & Gamble Mehoopany Mill,15394,Procter & Gamble Ppr Prdts Co,Wyoming,PA,41.574259,-76.04323
50464,Oxnard,15375,Procter&Gamble Paper Products Co-Oxnard,Ventura,CA,34.196,-119.1667
50465,Flint River Operations,20542,Weyerhaeuser Co,Macon,GA,32.2544,-84.0667
50466,Buckeye Florida LP,2522,Buckeye Florida Ltd Partners,Taylor,FL,30.0688,-83.5253
50468,Rocky Mount Mill,55876,Capitol Broadcasting Company Inc,Nash,NC,35.960058,-77.80244
50471,Deer Park Plant,14254,Oxy Vinyls LP,,,29.71,-95.11278
50472,"Covanta Niagara I, LLC",470,Covanta Energy of Niagara LP,Niagara,NY,43.0839,-79.0056
50473,Suwannee River Chemical Complex,20558,White Springs Agrici Chem Inc,,,30.4447,-82.7842
50474,Swift Creek Chemical Complex,20558,White Springs Agrici Chem Inc,Hamilton,FL,30.4522,-82.8644
50475,Corpus Christi,5065,Equistar Chemicals LP,Nueces,TX,27.811083,-97.59581
50476,Packaging of America Tomahawk Mill,14369,PCA-Tomahawk Mill,Lincoln,WI,45.4431,-89.7342
50479,Georgia-Pacific Big Island,7167,GP Big Island LLC,Bedford,VA,37.534,-79.357
50481,Tennessee Eastman Operations,5610,Eastman Chemical Co-TN Ops,Sullivan,TN,36.5219,-82.5431
50482,Clewiston Sugar House,19365,United States Sugar Corp,,,26.7351,-80.9377
50482,Clewiston Sugar House,19365,United States Sugar Corp,Hendry,FL,26.7351,-80.9377
50483,Bryant Sugar House,19365,United States Sugar Corp,,,26.814167,-80.66278
50485,Altech III,2770,Terra-Gen Operating Co LLC,Riverside,CA,33.915023,-116.5551
50487,PPG Powerhouse A,14306,Eagle 2 US LLC,Calcasieu,LA,30.225054,-93.28128
50488,PPG Riverside,14306,Eagle 2 US LLC,Calcasieu,LA,30.221746,-93.28069
50489,PPG Powerhouse C,14306,Eagle 2 US LLC,Calcasieu,LA,30.22612,-93.29517
50490,PPG Plant C Caustic,14306,Eagle 2 US LLC,Calcasieu,LA,30.226444,-93.29377
50491,Axiall Natrium Plant,60586,Westlake Chemical Natrium Plant,Marshall,WV,39.7475,-80.8547
50492,Gas Utilization Facility,16764,City of San Diego,San Diego,CA,32.679172,-117.2467
50493,Double C Generation Limited Partnership,60662,WCAC Operating Company,Kern,CA,35.5005,-119.046
50494,Kern Front Limited,60662,WCAC Operating Company,Kern,CA,35.51647,-119.0401
50495,High Sierra Limited,60662,WCAC Operating Company,Kern,CA,35.509041,-119.0305
50497,Bayonne Plant Holding LLC,56516,"Morris Energy Operations Company, LLC",,,40.655325,-74.11244
50498,Capitol District Energy Center,2956,Capitol District Energy Center,Hartford,CT,41.7639,-72.6925
505,Boysen,2518,U S Bureau of Reclamation,Fremont,WY,43.417872,-108.1775
50509,PCS Phosphate,22175,PCS Phosphate,Beaufort,NC,35.376266,-76.77986
50510,Mosaic Co Mulberry Facility,3102,Mosaic Company,,,27.891667,-81.925
50512,Glen Park Hydroelectric Project,60779,"Black River Hydroelectric, LLC",Jefferson,NY,44.000608,-75.96116
50513,Stillwater Reservoir Hydro,18121,Stillwater Associates,Herkimer,NY,43.897386,-75.04
50514,Fort Miller Hydroelectric Facility,6495,Fort Miller Associates,Saratoga,NY,43.160868,-73.58408
50530,Equilon Los Angeles Refining,55985,Tesoro Refining and Marketing Company,Los Angeles,CA,33.791667,-118.2347
50532,Victory Garden (Tehachapi),56899,Wind Stream Operations LLC,Kern,CA,35.0686,-118.3833
50533,Painted Hills Wind Park,61279,"HH Management, LLC",Riverside,CA,33.9369,-116.6183
50534,Santa Clara (85C),58661,"Sustainable Power Group, LLC",,,37.7361,-121.6475
50535,Mesa Wind Power Corp,11556,Brookfield Energy Marketing LP,Riverside,CA,33.9461,-116.6769
50536,Sky River LLC,17288,Sky River LLC,Kern,CA,35.2608,-118.2469
50537,SRI International Cogen Project,9297,IPT SRI Cogeneration Inc,San Mateo,CA,37.455314,-122.1728
50538,Black Hills Ontario Facility,1652,Black Hills Ontario LLC,,,34.055833,-117.6403
50539,Boltonville Hydro Associates,1966,Boltonville Hydro Associates,Orange,VT,44.1706,-72.0994
50540,BP Carson Refinery,2696,Tesoro Carson Refinery,Los Angeles,CA,33.8153,-118.2358
50541,Harbor Cogen,8303,Harbor Cogeneration Co.,Los Angeles,CA,33.7771,-118.2303
50544,Port Townsend Paper,26840,Port Townsend Paper Co,,,48.0931,-122.7958
50544,Port Townsend Paper,26840,Port Townsend Paper Co,Jefferson,WA,48.0931,-122.7958
50545,Lawrence Hydroelectric Associates,23576,Lawrence Hydroelectric Assoc,Essex,MA,42.6994,-71.1653
50546,Bowman,13402,Nevada Irrigation District,Nevada,CA,39.448352,-120.6534
50552,GPS Cabazon Wind LLC,61728,GlidePath Power Operations LLC,Riverside,CA,33.914986,-116.7103
50553,Edom Hills Project 1 LLC,61208,"Red Marlin Wind Ventures, LLC",,,33.881667,-116.4603
50553,Edom Hills Project 1 LLC,61208,"Red Marlin Wind Ventures, LLC",Riverside,CA,33.881667,-116.4603
50555,Rosemary Power Station,19876,Virginia Electric & Power Co,Halifax,NC,36.4517,-77.6594
50557,TXI Riverside Cement Power House,26940,U S West Financial Service Inc,,,34.606757,-117.336
50558,Oklahoma Cogeneration Project,17355,Oklahoma Cogeneration LLC,Oklahoma,OK,35.439722,-97.625
50560,Pacific-Ultrapower Chinese Station,58650,IHI Power Services Corp,Tuolumne,CA,37.874056,-120.4776
50561,Eagle Point Power Generation,49942,Eagle Point Power Generation LLC,Gloucester,NJ,39.8746,-75.1592
50563,Settlers Hill Gas Recovery,54843,WM Illinois Renewable Energy LLC,Kane,IL,41.871914,-88.28772
50564,New Milford Gas Recovery,54842,WM Renewable Energy LLC,,,41.547671,-73.42524
50564,New Milford Gas Recovery,54842,WM Renewable Energy LLC,Litchfield,CT,41.547671,-73.42524
50565,Monroe Livingston Gas Recovery,54842,WM Renewable Energy LLC,,,42.9903,-77.8011
50565,Monroe Livingston Gas Recovery,54842,WM Renewable Energy LLC,Monroe,NY,42.9903,-77.8011
50566,Milam Gas Recovery,54843,WM Illinois Renewable Energy LLC,St Clair,IL,38.6603,-90.1317
50568,High Acres Gas Recovery,54842,WM Renewable Energy LLC,Monroe,NY,43.081667,-77.38167
50569,DFW Gas Recovery,54842,WM Renewable Energy LLC,Denton,TX,33.019646,-96.96199
50570,Chestnut Ridge Gas Recovery,54842,WM Renewable Energy LLC,Anderson,TN,36.1172,-84.0317
50571,Altamont Gas Recovery,54842,WM Renewable Energy LLC,Alameda,CA,37.749308,-121.6499
50572,CSL Gas Recovery,54842,WM Renewable Energy LLC,Broward,FL,26.287966,-80.16653
50573,CID Gas Recovery,54843,WM Illinois Renewable Energy LLC,,,41.658794,-87.57772
50573,CID Gas Recovery,54843,WM Illinois Renewable Energy LLC,Cook,IL,41.658794,-87.57772
50575,Lake Gas Recovery,54843,WM Illinois Renewable Energy LLC,,,42.10625,-87.81374
50575,Lake Gas Recovery,54843,WM Illinois Renewable Energy LLC,Cook,IL,42.10625,-87.81374
50576,Metro Gas Recovery,54842,WM Renewable Energy LLC,Milwaukee,WI,42.850556,-88.06972
50577,Omega Hills Gas Recovery,54842,WM Renewable Energy LLC,Washington,WI,43.1922,-88.1597
50578,Stowe Power Production Plant,54842,WM Renewable Energy LLC,,,40.27244,-75.67035
506,La Junta,10536,City of La Junta - (CO),,,37.9876,-103.5468
506,La Junta,10536,City of La Junta - (CO),Otero,CO,37.9876,-103.5468
50601,Riverdale Mills,21678,Riverdale Mills Corp,,,42.140278,-71.63889
50602,Sconza Candy Company,56388,Sconza Candy Company,,,37.7667,-120.845
50610,Saint Johns Health Center,39245,Saint John's Health Center,Los Angeles,CA,34.030318,-118.4784
50611,Westwood Generation LLC,58224,"Rausch Creek Generation, LLC",Schuylkill,PA,40.6191,-76.45
50612,McKittrick Limited,60662,WCAC Operating Company,Kern,CA,35.319503,-119.662
50614,Mosinee Mill,13008,Expera Mosinee LLC,Marathon,WI,44.7881,-89.6917
50615,TXU Sweetwater Generating Plant,55983,Luminant Generation Company LLC,,,32.492831,-100.365
50620,Flambeau River Papers,54876,Flambeau River Papers,Price,WI,45.9356,-90.4472
50621,Central Power Plant,18000,State of Rhode Island,,,41.744973,-71.45842
50621,Central Power Plant,18000,State of Rhode Island,Providence,RI,41.744973,-71.45842
50622,Berry Cogen Tanne Hills 18,1569,Berry Petroleum Co,Kern,CA,35.089829,-119.4409
50623,Gaviota Oil Plant,15174,Freeport McMoRan Oil & Gas,Santa Barbara,CA,34.475067,-120.2051
50624,"Torrance Refining Company, LLC",60657,"Torrance Refining Company, LLC",Los Angeles,CA,33.85336,-118.33
50625,ExxonMobil Beaumont Refinery,6090,ExxonMobil Oil Corp,,,30.0636,-94.0753
50625,ExxonMobil Beaumont Refinery,6090,ExxonMobil Oil Corp,Jefferson,TX,30.0636,-94.0753
50626,Chalmette Refining LLC,56392,Chalmette Refining LLC,St Bernard,LA,29.9383,-89.97
50627,ExxonMobil Oil Joliet Refinery,5519,ExxonMobil Oil Corp,Will,IL,41.4167,-88.1833
50628,Paulsboro Refinery,19691,Paulsboro Refining Company - LLC,Gloucester,NJ,39.84,-75.2583
50629,Covanta Lake County Energy,4482,Covanta Lake Inc,Lake,FL,28.740206,-81.88919
50630,Covanta Marion Inc,4476,Covanta Marion Inc,Marion,OR,45.048467,-122.9628
50632,Covanta Stanislaus Energy,4498,Covanta Stanislaus Inc,Stanislaus,CA,37.3853,-121.141
50633,Mosaic Co Bartow Facility,3102,Mosaic Company,Polk,FL,27.908,-81.9185
50636,Brainerd Public Utilities,2138,Brainerd Public Utilities,,,46.3758,-94.1817
50636,Brainerd Public Utilities,2138,Brainerd Public Utilities,Crow Wing,MN,46.3758,-94.1817
50637,Clearwater Paper IPP Lewiston,56225,Clearwater Paper Corporation,Nez Perce,ID,46.423056,-116.9764
50638,Clearwater Paper APP CB,56225,Clearwater Paper Corporation,Desha,AR,33.7061,-91.2371
50639,Sappi Cloquet Mill,16653,Sappi Cloquet LLC,Carlton,MN,46.7243,-92.4298
50640,Warren Lumber Mill,15262,Potlatch Land and Lumber LLC,,,33.6206,-92.07889
50647,Covanta Indianapolis Energy,4497,Covanta Indianapolis Inc,Marion,IN,39.734456,-86.18908
50648,Covanta Bristol Energy,4474,Covanta Bristol Inc,Hartford,CT,41.6492,-72.9153
50649,Covanta Babylon Inc,4484,Covanta Babylon Inc,Suffolk,NY,40.7348,-73.3868
50650,ReEnergy Stratton LLC,1950,ReEnergy Stratton LLC,Franklin,ME,45.140614,-70.42558
50651,Syracuse Energy,19194,Syracuse Energy Corp,,,43.0653,-76.2086
50652,Lyonsdale Associates,2598,Burrows Paper Corp,Lewis,NY,43.618874,-75.30546
50654,Steamboat Hills LP,34691,Ormat Nevada Inc,Washoe,NV,39.37,-119.7669
50656,Huntington Resource Recovery Facility,9097,Huntington Resource Recovery,Suffolk,NY,40.8814,-73.2906
50657,Montgomery County Resource Recovery,49760,"Covanta Montgomery, Inc.",Montgomery,MD,39.2006,-77.4556
50658,Covanta Fairfax Energy,4425,Covanta Fairfax Inc,Fairfax,VA,38.695,-77.2411
50660,Covanta Tulsa Renewable Energy LLC,56316,Covanta Tulsa Renewable Energy LLC,Tulsa,OK,36.1319,-96.0181
50661,Covanta Haverhill,13982,Ogden Projects Inc-Haverhill,Essex,MA,42.765,-71.1242
50662,Onondaga County Resource Recovery,4487,Covanta Onondega LP,Onondaga,NY,43.0047,-76.1149
50663,Covanta Alexandria/Arlington Energy,4496,Covanta Alexandria/Arlington,Alexandria City,VA,38.8014,-77.1288
50664,Covanta Wallingford Energy,4427,Covanta Projects LP,,,41.440497,-72.83513
50666,Pasco Cnty Solid Waste Resource Recovery,14519,Pasco County,Pasco,FL,28.3681,-82.5583
50674,Municipal Cogen Plant,14395,Palm Springs City of,,,33.8247,-116.5106
50674,Municipal Cogen Plant,14395,Palm Springs City of,Riverside,CA,33.8247,-116.5106
50676,Thermo Power & Electric,18801,Thermo Power & Electric LLC,,,40.409025,-104.6846
50688,Gardiner,56838,KEI (Maine) Power Management (III) LLC,Kennebec,ME,44.221796,-69.78568
50690,San Gorgonio Westwinds II LLC,2770,Terra-Gen Operating Co LLC,Riverside,CA,33.934,-116.5781
50693,KMS Crossroads,10402,KMS Crossroads Inc,,,41.1044,-74.1622
50696,Plant No 1 Orange County,14155,Orange County Sanitation Dist,Orange,CA,33.6942,-117.9381
50699,Pumpkin Hill,56837,KEI (Maine) Power Management (II) LLC,Penobscot,ME,45.1868,-68.4649
507,Las Animas,10730,City of Las Animas - (CO),Bent,CO,38.0647,-103.2159
50700,Lilliwaup Falls Generating,15795,William G. Reed Jr,Mason,WA,47.4706,-123.1153
50702,Salmon Falls,4211,"Consolidated Hydro NH, Inc",York,ME,43.226977,-70.81089
50704,Somersworth Lower Great Dam,17902,"Somersworth Hydro Company, Inc.",Strafford,NH,43.251111,-70.84083
50707,JM Shafer Generating Station,30151,"Tri-State G & T Assn, Inc",Weld,CO,40.0986,-104.7736
50709,Thermo Greeley,18814,Thermo Greeley LLC,Weld,CO,40.4406,-104.6863
50711,University of Alaska Fairbanks,19511,University of Alaska,Fairbanks North Star,AK,64.854171,-147.8221
50712,Altamont Pass Windplant,10127,Kenetech Windpower Inc,,,37.7341,-121.6516
50713,Huntington Falls,7601,Green Mountain Power Corp,Addison,VT,44.0703,-73.1961
50718,Notch Butte Hydro,22696,Notch Butte Hydro Co Inc,Lincoln,ID,42.954384,-114.4626
50721,Tazewell Gas Recovery,54843,WM Illinois Renewable Energy LLC,Tazewell,IL,40.6817,-89.5167
50722,BP Naperville Cogeneration Facility,2836,BP America Inc,DuPage,IL,41.8108,-88.1486
50725,Blackjack Creek Treating,22502,Petro Operating Co,,,30.848333,-87.11333
50728,ExxonMobil Garden City Gas Plant,6529,Exxon Mobil Production Co,,,29.7,-91.55
50729,Clairton Works,19517,United States Steel- Clairton,Allegheny,PA,40.3097,-79.8819
50730,Fairfield Works,19370,United States Steel Corporation,,,33.4885,-86.9212
50732,Mon Valley Works,19519,United States Steel-Mon Valley,Allegheny,PA,40.3925,-79.8564
50733,Gary Works,19526,United States Steel-Gary,Lake,IN,41.622426,-87.32894
50736,Exeter Energy LP,57182,ReEnergy Sterling CT LP,Windham,CT,41.712448,-71.82225
50738,New Cornelia Branch Power Plant,15006,Phelps Dodge Mining Co,,,32.371111,-112.8622
50739,Pinetree Power Tamworth,15085,Pinetree Power- Tamworth LLC.,Carroll,NH,43.835833,-71.1967
50741,Pontook Hydro Facility,15213,Pontook Operating LP,Coos,NH,44.632842,-71.24742
50743,Starrett City Cogen Facility,18020,Starrett City Inc,Kings,NY,40.6492,-73.8792
50744,Sterling Power Plant,14182,Sterling Power Partners LP,Oneida,NY,43.080338,-75.60096
50745,Growgen,30897,Sunlaw Energy Partners I LP,,,33.405556,-119.2094
50746,Coidgen,30897,Sunlaw Energy Partners I LP,,,33.831389,-118.0242
50748,Agnews Power Plant,2871,OLS Energy-Agnews Inc.,Santa Clara,CA,37.4058,-121.9272
50750,Coalinga Cogeneration Facility,23005,Aera Energy LLC-Coalinga,Fresno,CA,36.170317,-120.3641
50751,Southeast Kern River Cogen,54713,Chevron USA Inc,Kern,CA,35.4206,-118.9644
50752,South Belridge Cogeneration Facility,164,AERA Energy LLC,Kern,CA,35.438611,-119.7075
50754,Oak Creek Energy Systems I,13938,Oak Creek Energy System Inc II,Kern,CA,35.043889,-118.2764
50755,New Hogan Power Plant,12745,Modesto Irrigation District,Calaveras,CA,38.149582,-120.8149
50758,Pejepscot Hydroelectric Project,19013,Topsham Hydro Partners,Sagadahoc,ME,43.957448,-70.02416
50759,West End Dam Hydroelectric Project,57144,Northbrook Carthage LLC,Jefferson,NY,43.98289,-75.62058
50760,Empire,56764,USG Nevada LLC,,,40.3714,-119.4092
50762,Ormesa IH,34691,Ormat Nevada Inc,,,32.7842,-115.2475
50763,Steamboat 1,34691,Ormat Nevada Inc,Washoe,NV,39.3939,-119.7537
50764,Ormesa IE,34691,Ormat Nevada Inc,,,32.8041,-115.2475
50765,Stillwater Facility,50131,Enel Stillwater LLC,,,39.547537,-118.5556
50765,Stillwater Facility,50131,Enel Stillwater LLC,Churchill,NV,39.547537,-118.5556
50766,Ormesa I,34691,Ormat Nevada Inc,,,32.8156,-115.2568
50766,Ormesa I,34691,Ormat Nevada Inc,Imperial,CA,32.8156,-115.2568
50768,Forestport,57184,Ampersand Mount Ida Hydro LLC,Oneida,NY,43.442468,-75.21595
50770,Viking Energy of McBain,19781,Viking Energy Corp,Missaukee,MI,44.204,-85.2206
50771,Viking Energy of Northumberland,19900,Viking Energy Corp,,,40.9172,-76.8146
50772,Viking Energy of Lincoln,19781,Viking Energy Corp,Alcona,MI,44.68,-83.4167
50774,Telogia Power,54827,Telogia Power LLC,Liberty,FL,30.3349,-84.8182
50776,Panther Creek Energy Facility,14432,"Panther Creek Power Operating, LLC",Carbon,PA,40.8556,-75.8781
50782,Taylor Energy Partners LP,21148,Zapco Energy Tactics Corp,,,41.387778,-75.71722
50788,Lafayette Energy Partners LP,21148,Zapco Energy Tactics Corp,,,41.175,-74.7631
50797,Newark Power Plant,2895,Calpine Newark LLC,,,40.736389,-74.12861
50799,Parlin Power Plant,61536,"Consolidated Edison Energy, Inc.",Middlesex,NJ,40.460717,-74.32716
508,Lamar Plant,10633,City of Lamar - (CO),Prowers,CO,38.033327,-102.5379
50801,Uncasville Mill,18153,RockTenn-Uncasville,,,41.4336,-72.0983
50803,Seminole Mill,27718,RockTenn-Seminole,Duval,FL,30.4178,-81.5978
50804,Port Wentworth Mill,20505,International Paper Port Wentworth Mill,Chatham,GA,32.1561,-81.1586
50805,Catalyst Paper Snowflake Mill,55973,Catalyst Paper Corp,,,34.50495,-110.3355
50806,Florence Mill,18162,WestRock-Florence,Florence,SC,34.1497,-79.5606
50807,WestRock Panama City Mill,18157,WestRock Corp-Panama City,Bay,FL,30.141984,-85.6211
50810,Westrock Hodge (LA),18155,Westrock (LA),,,32.2752,-92.7277
50810,Westrock Hodge (LA),18155,Westrock (LA),Jackson,LA,32.2752,-92.7277
50811,RockTenn Coshocton Mill,18158,RockTenn CP LLC Coshocton,,,40.27971,-81.86234
50812,Stone Container Ontonagon Mill,29820,Smurfit-Stone Corp MI Plant,,,46.87,-88.67389
50813,Hopewell Mill,18147,RockTenn-Hopewell,Hopewell City,VA,37.2914,-77.2816
50814,Stone Container Missoula Mill,17427,Smurfit-Stone Container Corp,,,46.959722,-113.7917
50815,Optim Energy Altura Cogen LLC,55879,Optim Energy LLC,Harris,TX,29.8161,-95.10773
50818,Dyer Road,58661,"Sustainable Power Group, LLC",,,37.7392,-121.4322
50819,ESI Project,58661,"Sustainable Power Group, LLC",,,37.739167,-121.4322
50820,East Winds Project,59901,Yavi Energy LLC,Riverside,CA,33.890913,-116.5415
50821,Mojave 16,2770,Terra-Gen Operating Co LLC,Kern,CA,35.045,-118.2642
50822,Mojave 17,2770,Terra-Gen Operating Co LLC,Kern,CA,35.044,-118.2765
50823,Mojave 18,2770,Terra-Gen Operating Co LLC,Kern,CA,35.046,-118.2757
50827,Twin Falls Hydro,19314,Twin Falls Hydro Associates LP,King,WA,47.444554,-121.6878
5083,Cumberland (NJ),56606,Calpine New Jersey Generation LLC,Cumberland,NJ,39.3757,-74.9654
50831,Nove Power Plant,13876,Nove Investments I LLC,Contra Costa,CA,37.9676,-122.382
50832,Chicopee Hydroelectric Station,3477,City of Chicopee - (MA),Hampden,MA,42.159595,-72.58279
50835,TES Filer City Station,18414,TES Filer City Station LP,Manistee,MI,44.217299,-86.28905
50837,Southeast Resource Recovery,16899,SERRF Joint Powers Authority,Los Angeles,CA,33.759236,-118.2399
50846,Gramercy Holdings LLC,56097,Gramercy Holdings LLC,,,30.054,-90.6693
50846,Gramercy Holdings LLC,56097,Gramercy Holdings LLC,St James,LA,30.054,-90.6693
50848,Weir Cogen Plant,22999,Aera Energy LLC-Weir,,,35.2381,-119.5847
50849,PE Berkeley,61261,Berkeley Cogeneration Facility,Alameda,CA,37.870331,-122.2634
50850,OLS Energy Chino,14265,OLS Energy-Chino,San Bernardino,CA,33.989626,-117.6809
50851,CSUCI Site Authority,56835,CSUCI Site Authority,Ventura,CA,34.161951,-119.0479
50852,Elmwood Park Power LLC,56516,"Morris Energy Operations Company, LLC",Bergen,NJ,40.905337,-74.13045
50855,Onondaga Cogeneration,14081,Onondaga Cogeneration LP,,,43.066667,-76.21667
50858,Hillsborough County Resource Recovery,8633,Hillsborough County,Hillsborough,FL,27.954901,-82.34047
50859,Lancaster County Resource Recovery,4447,Covanta Lancaster Inc,Lancaster,PA,40.0711,-76.6436
50860,Kent County Waste to Energy Facility,10162,Kent County,Kent,MI,42.949575,-85.69321
50863,Scott Wood,20934,Scott Wood,,,37.368611,-77.99861
50864,Sargent Canyon Cogeneration,16636,Sargent Canyon Cogeneration Co,Monterey,CA,35.9359,-120.8408
50865,Salinas River Cogeneration,16506,Salinas River Cogeneration Co,Monterey,CA,35.9515,-120.8679
50872,Wheelabrator Claremont Facility,20541,Wheelabrator Environmental Systems,,,43.344,-72.3773
50873,Wheelabrator Concord Facility,20541,Wheelabrator Environmental Systems,Merrimack,NH,43.2866,-71.5769
50874,Boralex Sherman LLC,55766,Boralex Sherman LLC,,,45.897937,-68.4345
50875,McKay Bay Facility,20541,Wheelabrator Environmental Systems,Hillsborough,FL,27.949528,-82.42118
50876,Wheelabrator Norwalk Energy,20541,Wheelabrator Environmental Systems,Los Angeles,CA,33.924898,-118.0679
50877,Wheelabrator North Andover,20541,Wheelabrator Environmental Systems,Essex,MA,42.7262,-71.1219
50878,Wheelabrator Millbury Facility,20541,Wheelabrator Environmental Systems,Worcester,MA,42.2214,-71.7669
50879,Wheelabrator Frackville Energy,20541,Wheelabrator Environmental Systems,Schuylkill,PA,40.782377,-76.17618
50880,Wheelabrator Saugus,20541,Wheelabrator Environmental Systems,Essex,MA,42.447,-70.9804
50881,Wheelabrator Shasta,20541,Wheelabrator Environmental Systems,,,40.428329,-122.2792
50881,Wheelabrator Shasta,20541,Wheelabrator Environmental Systems,Shasta,CA,40.428329,-122.2792
50882,Wheelabrator Westchester,20541,Wheelabrator Environmental Systems,Westchester,NY,41.277129,-73.94234
50883,Wheelabrator Bridgeport,20541,Wheelabrator Environmental Systems,Fairfield,CT,41.1625,-73.2083
50884,Pinellas County Resource Recovery,55871,"Covanta Projects, LLC",Pinellas,FL,27.8733,-82.6741
50885,Wheelabrator Gloucester LP,20541,Wheelabrator Environmental Systems,Gloucester,NJ,39.8733,-75.1381
50886,Spokane Waste to Energy,42892,City of Spokane,Spokane,WA,47.626327,-117.5042
50887,Wheelabrator South Broward,20541,Wheelabrator Environmental Systems,Broward,FL,26.0687,-80.1986
50888,Northampton Generating Company LP,23013,"EIF Northampton GP, LLC",Northampton,PA,40.6917,-75.4792
50890,Ivy River Hydro,11468,Madison Hydro Partners,Madison,NC,35.771627,-82.61827
50891,El Dorado Hydro Elk Creek,59380,"Enel Green Power NA, Inc.",Idaho,ID,45.217784,-116.3158
50892,Rock Creek LP,59380,"Enel Green Power NA, Inc.",El Dorado,CA,38.78342,-120.7785
50893,Allegheny No. 5 Hydro Station,59925,"All Dams Generation, LLC",Armstrong,PA,40.682875,-79.6653
50894,Allegheny No 6 Hydro Station,59925,"All Dams Generation, LLC",Armstrong,PA,40.716389,-79.57722
50895,Bypass,59380,"Enel Green Power NA, Inc.",Jerome,ID,42.560876,-114.0575
50896,S E Hazelton A,59380,"Enel Green Power NA, Inc.",Jerome,ID,42.586701,-114.0675
50897,Allegheny Hydro No 8,56813,Allegheny Hydro LP,Armstrong,PA,40.896596,-79.47898
50898,Allegheny Hydro No 9,56813,Allegheny Hydro LP,Armstrong,PA,40.955961,-79.55068
50900,Covington Facility,20508,WestRock Corp,,,37.799722,-79.9947
50900,Covington Facility,20508,WestRock Corp,Covington City,VA,37.799722,-79.9947
50903,Sagamore Plant Cogeneration,8,Tate & Lyle Ingredients Americas Inc,Tippecanoe,IN,40.4439,-86.86
50904,Fox Metro Water Reclamation District,6675,Fox Metro Water Reclamation,Kendall,IL,41.7128,-88.3522
50905,Univ New Mexico Cogen Plant,21964,University of New Mexico,,,35.120278,-106.6097
50906,Ford Utilities Center,21964,University of New Mexico,,,35.084078,-106.6252
50906,Ford Utilities Center,21964,University of New Mexico,Bernalillo,NM,35.084078,-106.6252
50907,Oswego County Energy Recovery,14222,Oswego County,Oswego,NY,43.348808,-76.42517
50909,Sherman Hospital,17105,Sherman Hospital,,,42.0544,-88.2817
50911,Bassett Table,1311,Bassett Furniture Industries Inc,,,36.759167,-79.99333
50912,J D Bassett Manufacturing,1311,Bassett Furniture Industries Inc,,,36.768333,-80.005
50914,Lavalley Lumber LLC,10766,Lavalley Lumber LLC,,,43.4175,-70.6569
50917,Middle Fork Irrigation District,12502,Middle Fork Irrigation Dist,Hood River,OR,45.480701,-121.5998
50920,Erie Coke,5959,Erie Coke Corp,Erie,PA,42.143919,-80.06958
50921,Co-Gen LLC,3770,Co-Generation Co,Grant,OR,44.458696,-118.7206
50925,San Jose Convention Center,30141,San Jose City of,,,37.330278,-121.8897
50931,Yellowstone Energy LP,21773,Yellowstone Energy LP,Yellowstone,MT,45.8117,-108.4278
50932,Des Moines Wastewater Reclamation Fac,5089,Des Moines Metro WRF,,,41.573415,-93.55774
50932,Des Moines Wastewater Reclamation Fac,5089,Des Moines Metro WRF,Polk,IA,41.573415,-93.55774
50933,Rhinelander Mill,61707,Ahlstrom-Munksjo,,,45.6394,-89.4205
50933,Rhinelander Mill,61707,Ahlstrom-Munksjo,Oneida,WI,45.6394,-89.4205
50934,Southernmost Waste To Energy,10226,"Utility Board of the City of Key West, FL",,,24.578333,-81.74694
50935,Caterpillar,3179,Caterpillar Inc,Tippecanoe,IN,40.4175,-86.8447
50936,Winnebago County Landfill Gas,20854,Winnebago County,,,44.083,-88.5411
50936,Winnebago County Landfill Gas,20854,Winnebago County,Winnebago,WI,44.083,-88.5411
